state_code,state_name,sch_num,sch_name,cust_code,cust_name,cust_town,status,type,category,accd_year,lga
011,Enugu,0117355,"GAB-SELINA SECONDARY SCHOOL, ENUGU",11028,"NECO SOUTH EAST ZONAL OFFICE, ENUGU",ENUGU,,,,,
011,Enugu,0117356,"GOD'S GIFT INTERNATIONAL SCHOOL, ENUGU",11028,"NECO SOUTH EAST ZONAL OFFICE, ENUGU",ENUGU,,,,,
032,Bayelsa,0321737,"EBINDU INTERNATIONAL SECONDARY SCHOOL, KAIAMA",32003,D.P.O.  KAIAMA,KAIAMA,,,,,
011,Enugu,0117359,"GOSHEN STARS GLOBAL COLLEGE, OLOGO ESTATE, ENUGU",11002,"SUB-TREASURY, ENUGU-SOUTH",ENUGU -  SOUTH,,,,,
011,Enugu,0117370,"LILY PINNACLE INTERNATIONAL COLLEGE, NEW HAVEN",11003,"NECO OFFICE, ENUGU",ENUGU,,,,,
011,Enugu,0117373,"MARVELLOUS GRACE, GRACE CHRYSOLYTE SCHOOL, NEW HAVEN, ENUGU",11003,"NECO OFFICE, ENUGU",ENUGU,,,,,
032,Bayelsa,0322951,"GEORGE TORRU INTERNATIONAL SCHL, AKENPAI",32002,"AREA COMMAND , OPOLO",OPOLO,,,,,
032,Bayelsa,0323346,"ST. CHARLES BORROMEO MINOR SEMINARY SCHOOL, IMIRINGI",32005,"DPO, KOLO",KOLO,,,,,
032,Bayelsa,0323417,"DIVINE INTERNATIONAL SCHOOL, YENAGOA",32002,"AREA COMMAND , OPOLO",OPOLO,,,,,
011,Enugu,0117382,"PRIME COLLEGE, ENUGU",11028,"NECO SOUTH EAST ZONAL OFFICE, ENUGU",ENUGU,,,,,
032,Bayelsa,0323476,"NADAM INTERNATIONAL ACADEMY, KPANSIA, YENAGOA B",32001,"NECO STATE OFFICE, YENAGOA",YENAGOA,,,,,
011,Enugu,0117387,"SATELLITE HIGH SCHOOL, OLOGO",11002,"SUB-TREASURY, ENUGU-SOUTH",ENUGU -  SOUTH,,,,,
011,Enugu,0117398,"VON SECONDARY SCHOOL, NEW HAVEN ENUGU",11030,"OJODU DEVELOPMENT CENTRE,",ABAKILIKI EXPRESS ROAD,,,,,
031,FCT,0318373,"SUCCESS WAY INTERNATIONAL ACADEMY, PYAKASA, ABUJA",31020,"POLICE STATION, LUGBE",LUGBE,,,,,
011,Enugu,0117417,"IMMACULATE COMPREHENSIVE SECONDARY SCHOOL, ENUGU",11022,"GIRL'S GRAMMAR SCHOOL, AWKUNANAW",AWKUNANAW,,,,,
032,Bayelsa,0323416,"EBI-ZIE GROUP OF SCHOOLS, YENAGOA",32002,"AREA COMMAND , OPOLO",OPOLO,,,,,
011,Enugu,0117430,"METHODIST COLLEGE, AGBANI ROAD, ENUGU",11002,"SUB-TREASURY, ENUGU-SOUTH",ENUGU -  SOUTH,,,,,
032,Bayelsa,0323580,"EXCELLENT GLORY INTERNATIONAL ACADEMY, OKAKA-EPIE YENAGOA, BEYELSA",32001,"NECO STATE OFFICE, YENAGOA",YENAGOA,,,,,
011,Enugu,0117521,"SPIRITAN INTERNATIONAL SECONDARY SCHOOL, ATTAKWU AKEGBE UGWU",11020,"OZALLA HIGH SCHOOL, OZALLA",OZALLA,,,,,
032,Bayelsa,0323721,"PEACEMAKERS INTERNATIONAL SCHOOLS, YENAGOA",32001,"NECO STATE OFFICE, YENAGOA",YENAGOA,,,,,
032,Bayelsa,0323969,"BEST BREED INTERNATIONAL ACADEMY, YENAGOA",32001,"NECO STATE OFFICE, YENAGOA",YENAGOA,,,,,
032,Bayelsa,0323970,"TIMINIPERE HAPPY SCHOOL, KAIAMA",32003,D.P.O.  KAIAMA,KAIAMA,,,,,
032,Bayelsa,0324070,"APEX ACADEMY, AMARATA, YENAGOA",32001,"NECO STATE OFFICE, YENAGOA",YENAGOA,,,,,
032,Bayelsa,0324072,"IJAW NATIONAL ACADEMY, KAIAMA",32003,D.P.O.  KAIAMA,KAIAMA,,,,,
032,Bayelsa,0324249,"ANGLICAN GIRLS GRAMMAR SCHOOL, KAIAMA",32003,D.P.O.  KAIAMA,KAIAMA,,,,,
032,Bayelsa,0324250,"EBIDOU COMPREHENSIVE ACADEMY, YENAGOA",32002,"AREA COMMAND , OPOLO",OPOLO,,,,,
032,Bayelsa,0324433,"HANSAL INTERNATIONAL SCHOOL, YENAGOA",32002,"AREA COMMAND , OPOLO",OPOLO,,,,,
011,Enugu,0117547,"ONWARD INTERNATIONAL SCHOOL, NSUKKA",11008,"SUB-TREASURY, NSUKKA",NSUKKA,,,,,
011,Enugu,0117566,"ROYAL SECONDARY SCHOOL, INYI OJI RIVER",11010,"ST. PAUL, OJI RIVER",OJI RIVER,,,,,
032,Bayelsa,0326072,"ST. PAUL'S IZON SCHOOL, AMARATA, YENAGOA",32001,"NECO STATE OFFICE, YENAGOA",YENAGOA,,,,,
032,Bayelsa,0326073,"FUNAKPO ACADEMY, OKUTUKUTU, YENAGOA",32002,"AREA COMMAND , OPOLO",OPOLO,,,,,
032,Bayelsa,0326499,"BENVIN CHILD DEVELOPMENT SECONDARY SCHOOL, EKEKI, YENAGOA",32001,"NECO STATE OFFICE, YENAGOA",YENAGOA,,,,,
011,Enugu,0117604,"GLORY SECONDARY SCHOOL, OBINAGU NGWO",11009,"CHRIST THE KING PARISH, NGWO-UNO",NGWO-UNO,,,,,
011,Enugu,0117634,"SPRINGFIELD COLLEGE, EMENE",11030,"OJODU DEVELOPMENT CENTRE,",ABAKILIKI EXPRESS ROAD,,,,,
011,Enugu,0117635,"FEDERAL AIRPORT AUTHORITY STAFF SCHOOL, EMENE",11004,"ST. PATRICK'S COLLEGE, ENUGU",ENUGU,,,,,
011,Enugu,0117640,"GODLY SEEDS CHRISTIAN COLLEGE, NIKE",11021,"ENUGU-EAST DEVELOPMENT CENTRE, ABAKPA",ABAKPA,,,,,
011,Enugu,0117668,"OLIVE GROOVE COLLEGE, UGWUONU NIKE",11004,"ST. PATRICK'S COLLEGE, ENUGU",ENUGU,,,,,
011,Enugu,0117685,"SYLVERSTEL STANDARD HIGH SCHOOL, ORBA ROAD NSUKKA",11008,"SUB-TREASURY, NSUKKA",NSUKKA,,,,,
011,Enugu,0117730,"COMMUNITY SECONDARY SCHOOL, AGUOBU IWOLLO",11025,"UMUCHINEMERE MICROFINANCE BANK, AFOR OGHE",AFOR OGHE,,,,,
011,Enugu,0117731,"DE MOULD ACADEMY, ENUGU",11021,"ENUGU-EAST DEVELOPMENT CENTRE, ABAKPA",ABAKPA,,,,,
032,Bayelsa,0323722,"DE-UNIQUE INTERNATIONAL ACADEMY, IGBOGENE YENAGOA",32002,"AREA COMMAND , OPOLO",OPOLO,,,,,
032,Bayelsa,0324071,"IKPOKEME SECONDARY SCHOOL, EDEPIE-EPIE, YENAGOA",32002,"AREA COMMAND , OPOLO",OPOLO,,,,,
032,Bayelsa,0323477,"PRAISE THE LORD GIRLS' ACADEMY, EDE-EPIE, YENAGOA",32002,"AREA COMMAND , OPOLO",OPOLO,,,,,
011,Enugu,0117737,"OAKFIELD INTERNATIONAL SCHOOL, ENUGU",11026,"TRANS-EKULU GIRLS SECONDARY SCHOOL, ENUGU",ENUGU,,,,,
011,Enugu,0117740,"UNIQUE AND FINE INTERNATIONAL SCHOOLS, ENUGU",11021,"ENUGU-EAST DEVELOPMENT CENTRE, ABAKPA",ABAKPA,,,,,
033,Ebonyi,0331296,RIGHT STEP INT'L SEC.SCH.ABAKAKILI,33001,"NECO OFFICE, ABAKALIKI",ABAKALIKI,,,,,
011,Enugu,0117783,"MADUKA UNIVERSITY COLLEGE, EKWEGBE",11033,"ST. MARY'S PARISH, EHA-ALUMONA",EHA-ALUMONA,,,,,
033,Ebonyi,0331404,"RIGHTSTEP INTERNATIONAL SCHOOL, ABALIKILI",33014,"EXAM DEV. CENTRE, EZZA RD, ABAKALIKI",ABAKALIKI,,,,,
012,Imo,0120015,"FEDERAL GOVERNMENT COLLEGE, OKIGWE",12004,"METHODIST CHURCH CATHEDRAL, OKIGWE",OKIGWE,,,,,
012,Imo,0120016,"FEDERAL GOVERNMENT GIRLS' COLLEGE, OWERRI",12001,"NECO OFFICE, OWERRI",OWERRI,,,,,
012,Imo,0120084,"ALVANA MODEL SEC. SCHOOL, OWERRI",12009,"EDUCATION SECRETARIATE ASSUMPTA, NEW OWERRI",NEW OWERRI,,,,,
012,Imo,0120176,PREMIER SEC. SCHL. ORJI OWERRI,12001,"NECO OFFICE, OWERRI",OWERRI,,,,,
012,Imo,0120201,"ROSELEC INT'L SCHOOL, AKOKWA",12005,"CHARLES HEEREY MEMORIAL, URUALLA",URUALLA,,,,,
012,Imo,0120229,"MADONNA MODEL SECONDARY SCHOOL, OWERRI",12001,"NECO OFFICE, OWERRI",OWERRI,,,,,
033,Ebonyi,0334986,ARMY DAY SECONDARY SCHOOL ABAKALIKI,33001,"NECO OFFICE, ABAKALIKI",ABAKALIKI,,,,,
033,Ebonyi,0334987,EKUMENYI SECONDARY SCHOOL ABAKALIKI,33016,"CHRIST THE KING CATHOLIC PARISH, EKUMENYI",EKUMENYI,,,,,
012,Imo,0120244,ST. PAUL'S IN T'L BOYS' SEC. SCH. OWERRI,12002,"NECO OFFICE, OWERRI II",OWERRI,,,,,
033,Ebonyi,0334989,COMPREHENSIVE SECONDARY SCHOOL AKPE AMACHI,33016,"CHRIST THE KING CATHOLIC PARISH, EKUMENYI",EKUMENYI,,,,,
033,Ebonyi,0334990,NDIEBOR AMACHI COMPREHENSIVE SECONDARY SCHOOL,33016,"CHRIST THE KING CATHOLIC PARISH, EKUMENYI",EKUMENYI,,,,,
033,Ebonyi,0334991,AZUOFIA EDDA COMMUNITY SECONDARY SCHOOL NDIOFUTU,33016,"CHRIST THE KING CATHOLIC PARISH, EKUMENYI",EKUMENYI,,,,,
033,Ebonyi,0334992,"MODERN GIRLS SECONDARY SCHOOL, NDIEBOR AMACHI",33001,"NECO OFFICE, ABAKALIKI",ABAKALIKI,,,,,
033,Ebonyi,0334993,"CHRIST THE KING COLLEGE, NDIECHI, AMACHI",33016,"CHRIST THE KING CATHOLIC PARISH, EKUMENYI",EKUMENYI,,,,,
012,Imo,0120293,H.H.C.J ASSUMPTA GIRLS' MODEL SEC. SCH. OWERRI,12001,"NECO OFFICE, OWERRI",OWERRI,,,,,
033,Ebonyi,0334995,OMAKORE COMMUNITY SECONDARY  SCHOOL EGWUAGU NDIAGU OKPITUMO,33016,"CHRIST THE KING CATHOLIC PARISH, EKUMENYI",EKUMENYI,,,,,
012,Imo,0120467,"ASSEMBLIES OF GOD BETHEL SEMINARY, NEKEDE",12008,"ST. PATRICK'S PARISH, NEKEDE",NEKEDE,,,,,
012,Imo,0120486,"LOGOS INT'L SEC. SCHOOL, AWO-OMAMMA",12006,"ST. STEPHEN'S ANGLICAN CHURCH, OTULU",OTULU,,,,,
012,Imo,0120989,LIVING WORD ACAD. SEC. NKWERRE,12007,"SS PETER AND PAUL CATHEDERAL, NKWERRE",NKWERRE,,,,,
012,Imo,0122973,"SHAMMAH INTERNATIONAL SECONDARY SCHOOL, OFEKATA ORODO",12001,"NECO OFFICE, OWERRI",OWERRI,,,,,
012,Imo,0123192,"GOLDSMITH SECONDARY SCHOOL, OWERRI",12002,"NECO OFFICE, OWERRI II",OWERRI,,,,,
033,Ebonyi,0335000,AMASIRI SECONDARY SCHOOL AMASIRI,33022,DEVELOPMENT CENTRE AMASIRI,AMASIRI,,,,,
033,Ebonyi,0335001,"AKPOHA SECONDARY TECHNICAL SCHOOL,",33020,"CHRIST THE KING CATHOLIC PARISH, ABAOMEGE",ABAOMEGE,,,,,
012,Imo,0123529,"RAY JACOBS BOARDING SCHOOL, MGBIDI, ORU WEST",12006,"ST. STEPHEN'S ANGLICAN CHURCH, OTULU",OTULU,,,,,
033,Ebonyi,0335003,EHUGBO TECHNICAL COLLEGE AFIKPO,33002,"ZONAL INSPECTORATE OF EDU. (ZIE), AFIKPO",AFIKPO,,,,,
012,Imo,0124015,"MOUNTAIN CREST HIGH SCHOOL, OWERRI",12009,"EDUCATION SECRETARIATE ASSUMPTA, NEW OWERRI",NEW OWERRI,,,,,
012,Imo,0124029,"LIVING WORD ACADEMY SECONDARY, AKWAKUMA",12001,"NECO OFFICE, OWERRI",OWERRI,,,,,
012,Imo,0123770,"PEARLVILLE SCHOOL, OWERRI",12019,"IMO STATE UNIVERSAL EDUCATION BOARD, OWERRI",OWERRI,,,,,
012,Imo,0120796,C.R.M. INTERNATIONAL COLLEGE,12019,"IMO STATE UNIVERSAL EDUCATION BOARD, OWERRI",OWERRI,,,,,
012,Imo,0124121,"POLICE SECONDARY SCHOOL, ISU",12007,"SS PETER AND PAUL CATHEDERAL, NKWERRE",NKWERRE,,,,,
012,Imo,0124122,"LIGHTHOUSE HIGH SCHOOL, ALADINMA",12002,"NECO OFFICE, OWERRI II",OWERRI,,,,,
033,Ebonyi,0335010,COMMUNITY SECONDARY SCHOOL AMASIRI,33022,DEVELOPMENT CENTRE AMASIRI,AMASIRI,,,,,
012,Imo,0124123,"OWERRI GIRLS SECONDARY SCHOOL, OWERRI",12009,"EDUCATION SECRETARIATE ASSUMPTA, NEW OWERRI",NEW OWERRI,,,,,
012,Imo,0124124,"FUTO INTERNATIONAL SCHOOL, OWERRI",12008,"ST. PATRICK'S PARISH, NEKEDE",NEKEDE,,,,,
033,Ebonyi,0335013,"AKPOHA COMPREHENSIVE SECONDARY SCHOOL, AMATA",33020,"CHRIST THE KING CATHOLIC PARISH, ABAOMEGE",ABAOMEGE,,,,,
033,Ebonyi,0335014,AMASIRI COMPREHENSIVE SECONDARY SCHOOL AMASIRI,33022,DEVELOPMENT CENTRE AMASIRI,AMASIRI,,,,,
012,Imo,0124388,"PEARLS INTERNATIONAL SCHOOL, UMUABIAHU MGBIDI",12006,"ST. STEPHEN'S ANGLICAN CHURCH, OTULU",OTULU,,,,,
033,Ebonyi,0335016,IBII COMMUNITY SECONDARY SCHOOL,33020,"CHRIST THE KING CATHOLIC PARISH, ABAOMEGE",ABAOMEGE,,,,,
033,Ebonyi,0335017,EKUMA UBAGHALA MEMORIAL SECONDARY SCHOOL AMASIRI.,33022,DEVELOPMENT CENTRE AMASIRI,AMASIRI,,,,,
012,Imo,0124389,"CHRISTIAN INTERNATIONAL HIGH SCHOOL,OWERRI",12002,"NECO OFFICE, OWERRI II",OWERRI,,,,,
012,Imo,0124628,"HOLY GHOST COLLEGE, OWERRI",12009,"EDUCATION SECRETARIATE ASSUMPTA, NEW OWERRI",NEW OWERRI,,,,,
033,Ebonyi,0335020,"OSO EDDA SECONDARY TECHNICAL SCHOOL, EDDA",33003,"SUB TREASURY, OWUTU",OWUTU,,,,,
012,Imo,0124630,"HOLY TRINITY INTERNATIONAL ACADEMY, EGBUOMA",12006,"ST. STEPHEN'S ANGLICAN CHURCH, OTULU",OTULU,,,,,
012,Imo,0124756,"CRYSTAL BRAIN ACADEMY,  UZOUBI-UMUNA",12003,"ST. MARY'S PARISH, AMIFEKE ORLU",AMIFEKE ORLU,,,,,
012,Imo,0124757,"COMMAND SCIENCE SECONDARY SCHOOL, ORLU",12003,"ST. MARY'S PARISH, AMIFEKE ORLU",AMIFEKE ORLU,,,,,
012,Imo,0125232,"EXCELLENT FOUNDATION COLLEGE AND SCHOOLS, MBIERI",12001,"NECO OFFICE, OWERRI",OWERRI,,,,,
012,Imo,0125233,"EXCEL INTERNATIONAL SECONDARY SCHOOL, OWERRI",12009,"EDUCATION SECRETARIATE ASSUMPTA, NEW OWERRI",NEW OWERRI,,,,,
012,Imo,0125234,"CREST FOUNDATION INTERNATIONAL SCHOOLS, MGBIDI",12006,"ST. STEPHEN'S ANGLICAN CHURCH, OTULU",OTULU,,,,,
012,Imo,0125235,"SUCCESS GARDEN INTERNATIONAL SECONDARY SCHOOL, IHIOMA, ORLU",12003,"ST. MARY'S PARISH, AMIFEKE ORLU",AMIFEKE ORLU,,,,,
033,Ebonyi,0335027,OZEM COMPREHENSIVE SECONDARY SCHOOL EDDA.,33003,"SUB TREASURY, OWUTU",OWUTU,,,,,
012,Imo,0125319,"SUN DREAM INTERNATIONAL SCHOOL, NEW OWERRI",12009,"EDUCATION SECRETARIATE ASSUMPTA, NEW OWERRI",NEW OWERRI,,,,,
033,Ebonyi,0335029,IDIMA EDDA SECONDARY SCHOOL OKPOROJO,33003,"SUB TREASURY, OWUTU",OWUTU,,,,,
012,Imo,0125320,"EMEAKAROHA FOUNDATION SECONDARY SCHOOL, IKPEREJERE",12011,"OUR LADY OF FATIMA PARISH, UMUAKAGU",UMUAKAGU,,,,,
012,Imo,0125322,"COLLINS AMERICAN INTERNATIONAL ACADEMY, IRETE-OWERRI",12015,"ST. KEVIN'S PARISH, OGBAKU",OGBAKU,,,,,
033,Ebonyi,0335032,OSO COMPREHENSIVE SECONDARY SCHOOL OSO EDDA,33003,"SUB TREASURY, OWUTU",OWUTU,,,,,
033,Ebonyi,0335033,AMAIYI COMPREHENSIVE SECONDARY SCHOOL,33003,"SUB TREASURY, OWUTU",OWUTU,,,,,
033,Ebonyi,0335034,"ABAKALIKI HIGH SCHOOL, ABAKALIKI(PRESCO)",33023,EBONYI TAX OFFICE KPIRIKPIRI ABAKALIKI,ABAKALIKI,,,,,
033,Ebonyi,0335035,"NNODO SECONDARY SCHOOL, ABAKALIKI",33023,EBONYI TAX OFFICE KPIRIKPIRI ABAKALIKI,ABAKALIKI,,,,,
033,Ebonyi,0335036,GOVERNMENT TECHNICAL COLLEGE ABAKALIKI,33023,EBONYI TAX OFFICE KPIRIKPIRI ABAKALIKI,ABAKALIKI,,,,,
012,Imo,0124755,"PASSION MODERN SCHOOLS, MPAMA EGBU",12018,"OUR LADY OF MOUNT CARMEL PARISH, EMEKUKU",EMEKUKU,,,,,
033,Ebonyi,0335038,MODEL COMPREHENSIVE GIRLS SECONDARY SCHOOL UGWUACHARA,33023,EBONYI TAX OFFICE KPIRIKPIRI ABAKALIKI,ABAKALIKI,,,,,
012,Imo,0125237,"TREASURE SCIENTIA SCHOOL, NAZE-OWERRI",12018,"OUR LADY OF MOUNT CARMEL PARISH, EMEKUKU",EMEKUKU,,,,,
033,Ebonyi,0335040,COMMUNITY SECONDARY SCHOOL MBEKE ISHIEKE,33018,"ST. STEPHEN CATHOLIC PARISH, IZZIOGO",IZZIOGO,,,,,
033,Ebonyi,0335041,NDIEGU ISHIEKE COMMUNITY HIGH SCHOOL NDIUGO,33018,"ST. STEPHEN CATHOLIC PARISH, IZZIOGO",IZZIOGO,,,,,
033,Ebonyi,0335042,COMMUNITY SECONDARY SCHOOL ONUENYIM ISHIEKE,33018,"ST. STEPHEN CATHOLIC PARISH, IZZIOGO",IZZIOGO,,,,,
033,Ebonyi,0335043,MGBOMEZE COMPREHENSIVE SECONDARY SCHOOL ODOMOKE,33017,"EBONYI L.G.E.A, UGBODO",UGBODO,,,,,
033,Ebonyi,0335044,COMMUNITY HIGH SCHOOL ONUENYIM- AGALEGU ISHIEKE,33018,"ST. STEPHEN CATHOLIC PARISH, IZZIOGO",IZZIOGO,,,,,
033,Ebonyi,0335045,COMMUNITY SECONDARY SCHOOL UGBONA ISHIEKE,33017,"EBONYI L.G.E.A, UGBODO",UGBODO,,,,,
033,Ebonyi,0335046,"NDIOKE GRAMMAR SCHOOL, ISHIEKE",33017,"EBONYI L.G.E.A, UGBODO",UGBODO,,,,,
033,Ebonyi,0335047,COMMUNITY SECONDARY SCHOOL ISOPHUMINI MBEKE ISHIEKE,33017,"EBONYI L.G.E.A, UGBODO",UGBODO,,,,,
033,Ebonyi,0335048,ABARIGWE TECHNICAL COLLEGE ABARIGWE ISHEKE,33017,"EBONYI L.G.E.A, UGBODO",UGBODO,,,,,
033,Ebonyi,0335049,PRISON SPECIAL SECONDARY SCHOOL ABAKALIKI,33001,"NECO OFFICE, ABAKALIKI",ABAKALIKI,,,,,
033,Ebonyi,0335050,COMMUNITY SECONDARY SCHOOL OJIEGBE,33017,"EBONYI L.G.E.A, UGBODO",UGBODO,,,,,
033,Ebonyi,0335051,"ST. AIDAN'S SECONDARY SCHOOL, UMUEZEKOHA",33024,EZZA WEST DEV. UMUEZOKA,UMUEZOKA,,,,,
033,Ebonyi,0335052,COMMUNITY SECONDARY SCHOOL UMUOGHARA,33014,"EXAM DEV. CENTRE, EZZA RD, ABAKALIKI",ABAKALIKI,,,,,
033,Ebonyi,0335053,COMMUNITY SECONDARY SCHOOL EKKA,33005,"SECONDARY EDUCATION BOARD, ONUEKE",ONUEKE,,,,,
033,Ebonyi,0335054,COMMUNITY SECONDARY SCHOOL NKOMORO,33024,EZZA WEST DEV. UMUEZOKA,UMUEZOKA,,,,,
033,Ebonyi,0335055,COMMUNITY SECONDARY SCHOOL OSHIEGBE,33024,EZZA WEST DEV. UMUEZOKA,UMUEZOKA,,,,,
012,Imo,0125417,"AZARAEGBELU SECONDARY SCHOOL, EMEKUKU",12018,"OUR LADY OF MOUNT CARMEL PARISH, EMEKUKU",EMEKUKU,,,,,
012,Imo,0124300,"DEEPER LIFE HIGH SCHOOL, OWERRI",12019,"IMO STATE UNIVERSAL EDUCATION BOARD, OWERRI",OWERRI,,,,,
033,Ebonyi,0335058,COMMUNITY SECONDARY SCHOOL UMEZEKOHA,33021,"OHAUKWU L.G.A, EZZAMGBO",EZZAMGBO,,,,,
033,Ebonyi,0335059,COMMUNITY SCHONDARY SCHOOL INYERE,33024,EZZA WEST DEV. UMUEZOKA,UMUEZOKA,,,,,
033,Ebonyi,0335060,IMOHA COMPREHENSIVE SECONDARY SCHOOL ACHIAGU OGBOJI,33005,"SECONDARY EDUCATION BOARD, ONUEKE",ONUEKE,,,,,
033,Ebonyi,0335061,COMMUNITY SECONDARY SCHOOL NDIAGU EKWETEKWE ONUNWORIE,33024,EZZA WEST DEV. UMUEZOKA,UMUEZOKA,,,,,
012,Imo,0124631,"HOLY ROSARY INTERNATIONAL COLLEGE, OWERRI",12019,"IMO STATE UNIVERSAL EDUCATION BOARD, OWERRI",OWERRI,,,,,
012,Imo,0124754,"DIVINE TRIUMPH INTERNATIONAL SCHOOL, UMUGUMA",12019,"IMO STATE UNIVERSAL EDUCATION BOARD, OWERRI",OWERRI,,,,,
012,Imo,0124629,"OUR LADY OF MOUNT CARMEL COLLEGE, EMEKUKU",12018,"OUR LADY OF MOUNT CARMEL PARISH, EMEKUKU",EMEKUKU,,,,,
012,Imo,0125458,"HANDMAIDS HOLY CHILD JUNIORATE, AMUMARA",12013,"ST. PATRICK'S PARISH, IBEKU",IBEKU,,,,,
012,Imo,0125459,"BESTWAY ROYAL CLASS SECONDARY TECHNICAL SCHOOL, AMAIFEKE",12003,"ST. MARY'S PARISH, AMIFEKE ORLU",AMIFEKE ORLU,,,,,
012,Imo,0125491,"DIOVINIC INTERNATIONAL  SECONDARY SCHOOL, OWERRI",12001,"NECO OFFICE, OWERRI",OWERRI,,,,,
033,Ebonyi,0335068,COMMUNITY SECONDARY SCHOOL AMUZU,33005,"SECONDARY EDUCATION BOARD, ONUEKE",ONUEKE,,,,,
012,Imo,0125492,"ST. MARTIN'S SECONDARY  SCHOOL, OWERRE-EBEIRI",12003,"ST. MARY'S PARISH, AMIFEKE ORLU",AMIFEKE ORLU,,,,,
012,Imo,0125748,"POSITIVE MINDS SECONDARY SCHOOL ORJI, OWERRI",12001,"NECO OFFICE, OWERRI",OWERRI,,,,,
033,Ebonyi,0335071,COMMUNITY SECONDARY SCHOOL ACHARA-UKWU NSOKKARA,33026,EZZA EAST DEV. CENTRE ONUZO UMUOGBOJI,UMUOGBOJI,,,,,
012,Imo,0125749,"DEUCTES INTERNATIONAL SCHOOLS, UMUECHEM, EZIOBODO",12008,"ST. PATRICK'S PARISH, NEKEDE",NEKEDE,,,,,
033,Ebonyi,0335073,"MODEL JUNIOR SECONDARY SCHOOL, ECHARA,",33026,EZZA EAST DEV. CENTRE ONUZO UMUOGBOJI,UMUOGBOJI,,,,,
012,Imo,0125750,"PRIME BRITISH INTERNATIONAL COLLEGE, PREFAB OWERRI",12002,"NECO OFFICE, OWERRI II",OWERRI,,,,,
033,Ebonyi,0335075,GIRLS HIGH SCHOOL EZILLO,33010,"CHRIST THE KING CATHOLIC PARISH, NKALAGU",NKALAGU,,,,,
012,Imo,0125751,"EXCELLENT HEIGHT HUB ACADEMY, URATTA, OWERRI",12002,"NECO OFFICE, OWERRI II",OWERRI,,,,,
033,Ebonyi,0335077,MODEL COMPREHSNSIVE SECONDARY SCHOOL UMUHUALI,33010,"CHRIST THE KING CATHOLIC PARISH, NKALAGU",NKALAGU,,,,,
033,Ebonyi,0335078,COMMUNITY SECONDARY SCHOOL EZZAGU,33015,"HEALTH CENTRE, AGBA",AGBA,,,,,
033,Ebonyi,0335079,GIRLS SPECIAL SCIENCE SCHOOL EZILLO,33010,"CHRIST THE KING CATHOLIC PARISH, NKALAGU",NKALAGU,,,,,
033,Ebonyi,0335080,COMMUNITY SECONDARY SCHOOL AZUINYABA,33010,"CHRIST THE KING CATHOLIC PARISH, NKALAGU",NKALAGU,,,,,
033,Ebonyi,0335081,COMMUNITY SECONDARY SCHOOL AGBA,33015,"HEALTH CENTRE, AGBA",AGBA,,,,,
033,Ebonyi,0335082,COMMUNITY BOYS HIGH SCHOOL EZILLO,33010,"CHRIST THE KING CATHOLIC PARISH, NKALAGU",NKALAGU,,,,,
033,Ebonyi,0335084,COMMUNITY SECONDARY SCHOOL NKALAHA,33010,"CHRIST THE KING CATHOLIC PARISH, NKALAGU",NKALAGU,,,,,
033,Ebonyi,0335085,UNION SECONDARY SCHOOL OBEGU,33010,"CHRIST THE KING CATHOLIC PARISH, NKALAGU",NKALAGU,,,,,
033,Ebonyi,0335086,COMMUNITY SECONDARY SCHOOL OHOFIA AGBA,33015,"HEALTH CENTRE, AGBA",AGBA,,,,,
033,Ebonyi,0335087,PREMIER SECONDARY SCHOOL OGBOJI EZZAGU,33015,"HEALTH CENTRE, AGBA",AGBA,,,,,
033,Ebonyi,0335088,COMMUNITY SECONDARY SCHOOL ONUNWEKE INYABA,33015,"HEALTH CENTRE, AGBA",AGBA,,,,,
033,Ebonyi,0335089,GIRLS SECONDARY SCHOOL AMANVU NKALAGU,33010,"CHRIST THE KING CATHOLIC PARISH, NKALAGU",NKALAGU,,,,,
033,Ebonyi,0335090,COMMUNITY SECONDARY SCHOOL EGUHO EZZAGU,33015,"HEALTH CENTRE, AGBA",AGBA,,,,,
033,Ebonyi,0335093,COMMUNITY SECONDARY SCHOOL UMUHUALI,33010,"CHRIST THE KING CATHOLIC PARISH, NKALAGU",NKALAGU,,,,,
012,Imo,0125753,"POPE JOHN PAUL II MODEL SECONDARY SCHOOL, UMUNAGBOR IHITTE,IHITTE",12013,"ST. PATRICK'S PARISH, IBEKU",IBEKU,,,,,
033,Ebonyi,0335095,IKWO HIGH SCHOOL AGUBIA,33019,IKWO SOUTH DEVELOPMENT CENTRE,IKWO,,,,,
033,Ebonyi,0335096,COMMUNITY SECONDARY SCHOOL NDIAGU ECHARA,33006,SUB TREASURY IKWO,IKWO,,,,,
033,Ebonyi,0335097,COMMUNITY SECONDARY SCHOOL ABINA IKWO,33006,SUB TREASURY IKWO,IKWO,,,,,
033,Ebonyi,0335098,COMMUNITY SECONDARY SCHOOL OKPUTIMO,33019,IKWO SOUTH DEVELOPMENT CENTRE,IKWO,,,,,
012,Imo,0125754,"PRINCETON MODEL COLLEGE, OWERRI",12009,"EDUCATION SECRETARIATE ASSUMPTA, NEW OWERRI",NEW OWERRI,,,,,
012,Imo,0125883,"DORA CHINYERE NWANKITI JUNIORATE, INYISHI",12012,"ST. MARY'S PARISH, IHO",IHO,,,,,
033,Ebonyi,0335101,COMMUNITY SECONDARY SCHOOL AKPA NWUDELE,33006,SUB TREASURY IKWO,IKWO,,,,,
012,Imo,0125885,"ST. THOMAS AQUINAS SEMINARY,  AMAKOHIA IHITTE",12011,"OUR LADY OF FATIMA PARISH, UMUAKAGU",UMUAKAGU,,,,,
033,Ebonyi,0335103,COMMUNITY SECONDARY SCHOOL IGBUDU,33006,SUB TREASURY IKWO,IKWO,,,,,
012,Imo,0125887,"BRAINSTARS INTERNATIONAL ACADEMY, OGBAKU",12015,"ST. KEVIN'S PARISH, OGBAKU",OGBAKU,,,,,
033,Ebonyi,0335105,"MODEL COMPREHENSIVE SECONDARY SCHOOL, AGUBIA, IKWO",33006,SUB TREASURY IKWO,IKWO,,,,,
012,Imo,0125889,"ST. COLUMBA'S COLLEGE, AMAIMO",12012,"ST. MARY'S PARISH, IHO",IHO,,,,,
033,Ebonyi,0335107,UNITY SECONDARY SCHOOL ITEM AMAGU,33019,IKWO SOUTH DEVELOPMENT CENTRE,IKWO,,,,,
033,Ebonyi,0335108,PREMIER SECONDARY SCHOOL AMAGU,33019,IKWO SOUTH DEVELOPMENT CENTRE,IKWO,,,,,
033,Ebonyi,0335109,"ENYI COMMUNITY SECONDARY SCHOOL, ENYIBICHIRI",33006,SUB TREASURY IKWO,IKWO,,,,,
033,Ebonyi,0335110,COMMUNITY SECONDARY SCHOOL NOYO-IKWO,33006,SUB TREASURY IKWO,IKWO,,,,,
012,Imo,0125891,"FATIMA SECONDARY SCHOOL,  UMUAKAGU NSU",12011,"OUR LADY OF FATIMA PARISH, UMUAKAGU",UMUAKAGU,,,,,
033,Ebonyi,0335112,"COMMUNITY SECONDARY SCHOOL, IGWELEDOHA",33019,IKWO SOUTH DEVELOPMENT CENTRE,IKWO,,,,,
012,Imo,0125892,"LUMEN CHRISTI GIRLS' SECONDARY SCHOOL, UMUEWERE NGURU",12010,"ST. THERESA'S PARISH, NGURU UMUARU(NGOR OKPALA )",NGOR-OKPALA,,,,,
033,Ebonyi,0335114,COMMUNITY SECONDARY SCHOOL NDIAGU AZU ENYIBICHIRI IKWO,33006,SUB TREASURY IKWO,IKWO,,,,,
012,Imo,0125893,"FAITHHOUSE LEADERSHIP ACADEMY, UGWU-ORJI",12001,"NECO OFFICE, OWERRI",OWERRI,,,,,
033,Ebonyi,0335116,IDAM AJA COMMUNITY SECONDARY SCHOOL NDIAGU ELIGWU ETTAM,33019,IKWO SOUTH DEVELOPMENT CENTRE,IKWO,,,,,
012,Imo,0125894,"FATHER PHILIP AGU SPIRITAN ACADEMY, AKABO",12012,"ST. MARY'S PARISH, IHO",IHO,,,,,
012,Imo,0125895,"PRIMUS REDEMPTORIS INTERNATIONAL SCHOOL, OBETITI NGURU",12013,"ST. PATRICK'S PARISH, IBEKU",IBEKU,,,,,
012,Imo,0125896,"ALL SAINTS MODEL SECONDARY TECHNICAL SCHOOL, UGWAKU",12004,"METHODIST CHURCH CATHEDRAL, OKIGWE",OKIGWE,,,,,
012,Imo,0125888,"SISTERS OF JESUS CRUCIFIED MODEL SECONDARY SCHOOL, URATTA",12018,"OUR LADY OF MOUNT CARMEL PARISH, EMEKUKU",EMEKUKU,,,,,
033,Ebonyi,0335091,COMPREHENSIVE SECONDARY SCHOOL IYONU,33010,"CHRIST THE KING CATHOLIC PARISH, NKALAGU",NKALAGU,,,,,
012,Imo,0125886,"NECH INTERNATIONAL SECONDARY TECHNICAL COLLEGE, UMUORII-IHITTA OGADA",12018,"OUR LADY OF MOUNT CARMEL PARISH, EMEKUKU",EMEKUKU,,,,,
012,Imo,0125897,"GIOJA SECONDARY SCHOOL, MGBELE, OGUTA",12015,"ST. KEVIN'S PARISH, OGBAKU",OGBAKU,,,,,
012,Imo,0125898,"HANDMAIDS GIRLS' MODEL SECONDARY SCHOOL, AREA G, NEW OWERRI",12009,"EDUCATION SECRETARIATE ASSUMPTA, NEW OWERRI",NEW OWERRI,,,,,
012,Imo,0125899,"MADRE GIOVANNA RUSSOLILLO GROUP OF SCHOOLS, IBEKU, OKWUATO MBAISE",12013,"ST. PATRICK'S PARISH, IBEKU",IBEKU,,,,,
012,Imo,0125900,"AKABO HIGH SCHOOL, AKABO",12012,"ST. MARY'S PARISH, IHO",IHO,,,,,
033,Ebonyi,0335127,BOYS SECONDARY SCHOOL IBOKO,33008,"IZZI MICROFINANNCE BANK, IBOKO",IBOKO,,,,,
012,Imo,0125901,"PAC COLLEGE, EGBEADA, OWERRI",12001,"NECO OFFICE, OWERRI",OWERRI,,,,,
012,Imo,0126111,"BRAINYWYSE COLLEGE, NAZE OWERRI",12002,"NECO OFFICE, OWERRI II",OWERRI,,,,,
033,Ebonyi,0335130,COMMUNITY SECONDARY SCHOOL NWOFE,33017,"EBONYI L.G.E.A, UGBODO",UGBODO,,,,,
012,Imo,0126112,"OUR SAVIOUR'S ANGLICAN SECONDARY SCHOOL, ABAZU OGWA",12012,"ST. MARY'S PARISH, IHO",IHO,,,,,
033,Ebonyi,0335132,COMMUNITY SECONDARY SCHOOL IGBEAGU,33016,"CHRIST THE KING CATHOLIC PARISH, EKUMENYI",EKUMENYI,,,,,
033,Ebonyi,0335133,LIBERATION SECONDARY SCHOOL ONUNWAKPU-IZZI,33016,"CHRIST THE KING CATHOLIC PARISH, EKUMENYI",EKUMENYI,,,,,
012,Imo,0126113,"OBAZU COMMUNITY SECONDARY SCHOOL, MBIERI",12001,"NECO OFFICE, OWERRI",OWERRI,,,,,
033,Ebonyi,0335135,NDIEGU-AGBAJA COMMUNITY SECONDARY SCHOOL AKPURATA IBINA,33018,"ST. STEPHEN CATHOLIC PARISH, IZZIOGO",IZZIOGO,,,,,
033,Ebonyi,0335136,UNION COMPREHENSIVE SECONDARY SCHOOL NDIEZEOKE,33008,"IZZI MICROFINANNCE BANK, IBOKO",IBOKO,,,,,
033,Ebonyi,0335137,UNITY COMPREHENSIVE SECONDARY SCHOOL OCHAFU,33008,"IZZI MICROFINANNCE BANK, IBOKO",IBOKO,,,,,
033,Ebonyi,0335138,NDIEZE COMMUNITY SECONDARY SCHOOL OHAGE WAKA,33008,"IZZI MICROFINANNCE BANK, IBOKO",IBOKO,,,,,
033,Ebonyi,0335139,COMMUNITY SECONDARY SCHOOL MKPUMA-EKWOKU,33008,"IZZI MICROFINANNCE BANK, IBOKO",IBOKO,,,,,
033,Ebonyi,0335140,COMMUNITY SECONDARY SCHOOL ETTE IZZI,33018,"ST. STEPHEN CATHOLIC PARISH, IZZIOGO",IZZIOGO,,,,,
033,Ebonyi,0335141,STATION VOCATIONAL SECONDARY SCHOOL NDIOGBU IZZI,33008,"IZZI MICROFINANNCE BANK, IBOKO",IBOKO,,,,,
033,Ebonyi,0335142,"COMPREHENSIVE SECONDARY SCHOOL, NDINWANGBA IZZI",33018,"ST. STEPHEN CATHOLIC PARISH, IZZIOGO",IZZIOGO,,,,,
033,Ebonyi,0335143,COMMUNITY SECONDARY SCHOOL IZIOGO,33018,"ST. STEPHEN CATHOLIC PARISH, IZZIOGO",IZZIOGO,,,,,
033,Ebonyi,0335144,"STATE SPECIAL JUNIOR SECONDARY SCHOOL OPEFFIA, IBOKO IZZI",33008,"IZZI MICROFINANNCE BANK, IBOKO",IBOKO,,,,,
012,Imo,0126114,"ST. BARTHOLOMEW AND HELEN MODEL SECONDARY SCHOOL, UMUEZEALA",12011,"OUR LADY OF FATIMA PARISH, UMUAKAGU",UMUAKAGU,,,,,
033,Ebonyi,0335146,"MODEL JUNIOR SECONDARY SCHOOL, OFEREKPE AGBAJA",33018,"ST. STEPHEN CATHOLIC PARISH, IZZIOGO",IZZIOGO,,,,,
033,Ebonyi,0335147,BOYS SECONDARY SCHOOL EZZAMGBO,33004,"SUB-TREASURY, EZZAMGBO",EZZAMGBO,,,,,
033,Ebonyi,0335148,COMMUNITY SECONDARY SCHOOL AMOFFIA NGBO,33013,"CHRIST OUR SAVIOUR CATHOLIC CHURCH, NGBO",NGBO,,,,,
033,Ebonyi,0335149,IJINIKE HIGH SCHOOL NGBO,33025,"NGBO WEST DEV. CENTRE, UMUOGUDU AKPU",UMUOGUDU AKPU,,,,,
033,Ebonyi,0335150,GIRLS SECONDARY SCHOOL NDULO NGBO,33013,"CHRIST OUR SAVIOUR CATHOLIC CHURCH, NGBO",NGBO,,,,,
033,Ebonyi,0335151,"UMUEZEAKA HIGH SCHOOL, NGBO",33013,"CHRIST OUR SAVIOUR CATHOLIC CHURCH, NGBO",NGBO,,,,,
012,Imo,0126115,"MOTHER OF MERCY CONVENT SECONDARY SCHOOL, UMUNAKANU OWERRE",12011,"OUR LADY OF FATIMA PARISH, UMUAKAGU",UMUAKAGU,,,,,
033,Ebonyi,0335153,COMMUNITY SCONDARY SCHOOL EKWASHI NGBO,33025,"NGBO WEST DEV. CENTRE, UMUOGUDU AKPU",UMUOGUDU AKPU,,,,,
012,Imo,0126116,"ST. PATRICK SECONDARY SCHOOL, OGBE AHIARA",12017,"ST. PATRICK PARISH, OGBE AHIAZU MBAISE",OGBE AHIAZU MBAISE,,,,,
012,Imo,0126117,"CHOSEN INTERNATIONAL SECONDARY SCHOOL, MGBIDI",12006,"ST. STEPHEN'S ANGLICAN CHURCH, OTULU",OTULU,,,,,
033,Ebonyi,0335156,COMMUNITY SECONDARY SCHOOL EBETA EFFIUM,33011,"ST. CHARLES CATHOLIC PARISH, EFFIUM",EFFIUM,,,,,
033,Ebonyi,0335157,EFFIUM HIGH SCHOOL,33011,"ST. CHARLES CATHOLIC PARISH, EFFIUM",EFFIUM,,,,,
033,Ebonyi,0335158,COMMUNITY SECONDARY SCHOOL EFFIUM,33011,"ST. CHARLES CATHOLIC PARISH, EFFIUM",EFFIUM,,,,,
033,Ebonyi,0335159,COMMUNITY SECONDARY SCHOOL UMUOGUDU OSHIA,33025,"NGBO WEST DEV. CENTRE, UMUOGUDU AKPU",UMUOGUDU AKPU,,,,,
033,Ebonyi,0335160,COMMUNITY SECONDARY SCHOOL ABOGODO NGBO,33025,"NGBO WEST DEV. CENTRE, UMUOGUDU AKPU",UMUOGUDU AKPU,,,,,
012,Imo,0126118,"CHARLES HEEREY MEMORIAL JUNIORATE, URUALLA",12005,"CHARLES HEEREY MEMORIAL, URUALLA",URUALLA,,,,,
012,Imo,0126120,"SACRED HEART SECONDARY SCHOOL, AKWAKUMA",12001,"NECO OFFICE, OWERRI",OWERRI,,,,,
033,Ebonyi,0335163,UKWUAGBA HIGH SCHOOL NGBO,33013,"CHRIST OUR SAVIOUR CATHOLIC CHURCH, NGBO",NGBO,,,,,
033,Ebonyi,0335164,UGOEZE SECONDARY SCHOOL EFFIUM,33011,"ST. CHARLES CATHOLIC PARISH, EFFIUM",EFFIUM,,,,,
