state_code,state_name,sch_num,sch_name,cust_code,cust_name,cust_town,status,type,category,accd_year,lga
003,Akwa Ibom,0031393,"ONYIEME GLORIOUS COLLEGE, ORON",03005,"SUB -TREASURY, ORON",ORON,,,,,
018,Kogi,0182062,UBE/JSS AKAYA-EJULE,,,,,,,,
003,Akwa Ibom,0033593,"THE APOSTOLIC CHURCH SCHOOLS, UYO",03001,"NECO STATE OFFICE, UYO",UYO,,,,,
003,Akwa Ibom,0036783,"DESTINY SECONDARY SCHOOL, EKET",03003,"ZONAL EDUCATION OFFICE - LIVERPOOL ROAD, EKET",EKET,,,,,
004,Anambra,0040052,"LAKECITY SECONDARY SCHOOL, NRI",,,,,,,,
004,Anambra,0048041,"BLESSED INTERNATIONAL SECONDARY SCHOOL, IYIOWA ODEKPE",,,,,,,,
005,Bauchi,0050130,"FOMWAN SCHOOL FEDERAL LOW-COST, BAUCHI",,,,,,,,
005,Bauchi,0052566,"GOVT JUNIOR SEC. SCHOOL, GOBIYA",,,,,,,,
005,Bauchi,0052567,"HAMAYO VOCATIONAL SEC. SCHOOL, MUSA",,,,,,,,
007,Borno,0070287,BENEX COMPREHENSIVE SCHOOL,07004,NJIMTILO POLICE STATION,JIMTILO,,,,,
007,Borno,0071413,"MILLENIUM INTL. SCHOOL, MAIDUGURI",07001,NECO OFFICE,MAIDUGURI,,,,,
007,Borno,0076425,"ISMAT INTERNATIONAL ACADEMY, MODUGANARI BYPASS, MAIDUGURI",07005,"DISTRICT HEAD PALACE, AUNO",AUNO,,,,,
018,Kogi,0182063,UBE/JSS OKULA-ALLOMA,,,,,,,,
008,Cross River,0085741,"COLMCILLE MEMORIAL ACADEMY, NTAMENTE",08010,"POLICE STATION, OKUNDI",OKUNDI,,,,,
008,Cross River,0086530,"AUNTY HARRISON HIGH SCHOOL, UWANSE, CALABAR",08007,"FIRST BANK PLC, MBUKPA",MBUKPA,,,,,
009,Delta,0095314,"BENITA INTERNATIONAL SCHOOL, ASABA",09001,"NECO STATE OFFICE, ASABA",ASABA,,,,,
010,Edo,0105829,"GOLDEN STRIDES INTERNATIONAL SCHOOL,AMAGBA, BENIN CITY",10008,"NSCDC LIMIT ROAD, BENIN CITY",BENIN CITY,,,,,
010,Edo,0108198,GOD'S MERCY DIVINE MONTESSORI ACADEMY OGHEKA BENIN CITY,,,,,,,,
018,Kogi,0182064,UBE/JSS AHI,,,,,,,,
011,Enugu,0117184,"SPECIAL SCIENCE SCHOOL, EZINESI ODUMA",11032,"ST. ANTHONY'S PARISH, ODUMA",ODUMA,,,,,
011,Enugu,0117378,"OZOUGWU COMPREHENSIVE  SECONDARY SCHOOL, NGWO",11009,"CHRIST THE KING PARISH, NGWO-UNO",NGWO-UNO,,,,,
011,Enugu,0117411,"GOD'S TIME SECONDARY SCHOOL, ENUGU",11003,"NECO OFFICE, ENUGU",ENUGU,,,,,
018,Kogi,0182065,UBE/JSS AJOH,,,,,,,,
011,Enugu,0117714,"GOVERNMENT COLLEGE, AGBANI",11005,"P.P.S.M.B. ZONAL OFFICE, AGBANI",AGBANI,,,,,
012,Imo,0126803,"FR. JUSTIN INTERNATIONAL SECONDARY SCHOOL, AKATTA",12006,"ST. STEPHEN'S ANGLICAN CHURCH, OTULU",OTULU,,,,,
018,Kogi,0182066,UBE/JSS OJUWO-OMACHI,,,,,,,,
012,Imo,0128203,"SANCTA MARIA SECONDARY SCHOOL, UVURU",,,,,,,,
013,Jigawa,0131843,"TALENT OF WISDOM FOR SECONDARY SCHOOL, GUMEL",13002,"ZONAL EDUCATION OFFICE, GUMEL",GUMEL,,,,,
018,Kogi,0182067,UBE/JSS OJUWA-OCHA,,,,,,,,
014,Kaduna,0144476,"AL-FAUZAN ACADEMY, KAWO, KADUNA",14007,"FED. MORTGAGE BANK, ALI AKILU RD, KADUNA",KADUNA,,,,,
015,Kano,0157848,AL-QIBLA INTERNATIONAL ACADEMY RIJIYAR ZAKI KANO,15005,FIRST BANK KABUGA,KABUGA,,,,,
018,Kogi,0181933,"GOD'S DOMINION SEC.SCH,ITOBE",,,,,,,,
018,Kogi,0182068,UBE/JSS ADAMU,,,,,,,,
018,Kogi,0182069,UBE/JSS OJODU,,,,,,,,
018,Kogi,0182070,UBE/JSS OGBABO,,,,,,,,
018,Kogi,0183638,"BLUE PEARLS ACADEMY, IDAH",18004,UBA IDAH,IDAH,,,,,
019,Kwara,0190648,"C.A.C SECONDARY SCHOOL, GAA-AKANBI",,,,,,,,
019,Kwara,0193208,"HAVILAH SPRING COLLEGE, AGO-OJA",,,,,,,,
018,Kogi,0182071,UBE/JSS OFABO,,,,,,,,
018,Kogi,0182072,UBE/JSS ONITCHA-IGOH,,,,,,,,
020,Lagos,0200542,PYTHAGORAS COLLEGE,20004,"WEMA BANK,OGBA",OGBA,,,,,
018,Kogi,0182073,UBE/JSS OBAJE-AKO,,,,,,,,
018,Kogi,0182074,UBE/JSS ALOME-UGNONAMO,,,,,,,,
018,Kogi,0182075,UBE/JSS AKPAGIDIGBO,,,,,,,,
018,Kogi,0182117,UBE/JSS OKENYA,,,,,,,,
018,Kogi,0182118,UBE/JSS IBOCHI,,,,,,,,
025,Oyo,0250521,MUSLIM MODEL COLLEGE,25009,"POLARIS BANK, DUGBE",DUGBE,,,,,
024,Osun,0243347,"THE WINGS SECONDARY SCHOOL, IWO",24014,"POLARIS BANK, IWO",IWO,,,,,
015,Kano,0150256,"EXCEL COLLEGE, KANO",15001,"NECO OFFICE, KANO",KANO,,,,,
020,Lagos,0207883,"GLOMAT BLOSSOM COLLEGE, IJEGUN-IMORE, SATELLITE",20018,"NIGERIAN NAVY BARRACKS, NAVY TOWN, SATELLITE",SATELLITE,,,,,
021,Niger,0211871,"KOWA SCHOOLS KPAKUNGU,MINNA",21002,POLICE STATION MORRIS FERTILIZER AREA,MINNA,,,,,
022,Ogun,0221177,PRESTON  INTERNATINONAL  SCHOOL,,,,,,,,
023,Ondo,0234671,"DIOCESAN COMPREHENSIVE COLLEGE, ONDO",23004,"NIGERIAN SECURITY & CIVIL DEFENCE CORPS, ONDO",ONDO,,,,,
018,Kogi,0182119,UBE/JSS OJUWOCHA,,,,,,,,
018,Kogi,0182120,UBE/JSS OFARACHI,,,,,,,,
018,Kogi,0182121,UBE/JSS AYEKE,,,,,,,,
005,Bauchi,0052578,"GOVT JUNIOR SEC. SCHOOL, MARTIN GIJI T/BALEWA",,,,,,,,
005,Bauchi,0052579,"GOVT JUNIOR SEC. SCHOOL, DUNGA T/BALEWA",,,,,,,,
018,Kogi,0182122,UBE/JSS ODEKE,,,,,,,,
018,Kogi,0182123,UBE/JSS OBALE,,,,,,,,
005,Bauchi,0052580,"GOVT JUNIOR SEC. SCHOOL, BOGORO",,,,,,,,
018,Kogi,0182124,JSS ONYEDEGA,,,,,,,,
005,Bauchi,0052581,"GOVT JUNIOR SEC. SCHOOL, SARA TAFAWA BALEWA",,,,,,,,
005,Bauchi,0052582,"GOVT DAY JUNIOR SEC. SCHOOL, BOI BOGORO",,,,,,,,
025,Oyo,0258121,"PROLIFIC ERUDITE COLLEGE,  OJOO, IBADAN",,,,,,,,
025,Oyo,0258308,"AL-QALAM COLLEGE, OLOGUNERU IBADAN",,,,,,,,
002,Adamawa,0028388,"NEXORA ACADEMY, YOLA",02009,"UNION BANK PLC, JIMETA",JIMETA,,,,,
018,Kogi,0182326,COMM. SEC SCH IGBO-ERO,,,,,,,,
018,Kogi,0182327,"ST. KIZITO'S COLL ,ISANLU",,,,,,,,
005,Bauchi,0052583,"GCSS, MALAKRI TAFAWA BALEWA",,,,,,,,
018,Kogi,0182328,GOVT.DAY SCI. SCH ISANLU,,,,,,,,
027,Rivers,0273739,"HUMILITY KNOWLEDGE ACADEMY, PORT-HARCOURT",27017,"KALA POLICE STATION, PH",RUMUOKWUTA,,,,,
018,Kogi,0182378,"SOLARDAD COLLEGE, OKENE",,,,,,,,
018,Kogi,0182379,"EXCELLENCE COLLEGE, OKENE",,,,,,,,
027,Rivers,0274414,"HERITAGE CREST INTERNATIONAL SCHOOL, PORT- HARCOURT",27022,"POLICE STATION, CHOBA",CHOBA,,,,,
009,Delta,0091013,"COMMAND SECONDARY SCHOOL, MBIRI",09005,POLICE STATION UMUNEDE,UMUNEDE,,,,,
005,Bauchi,0052584,"GOVT JUNIOR SEC. SCHOOL, MUSANYI TAFAWA BALEWA",,,,,,,,
005,Bauchi,0052585,"GOVT JUNIOR SEC. SCHOOL, YELWAN DUGURI",,,,,,,,
018,Kogi,0182380,UBE/JSS EYOODODO,,,,,,,,
018,Kogi,0182381,"GOVT. SEC. SCHL, OKENE",,,,,,,,
028,Sokoto,0280038,"F.G.C, SOKOTO",28001,"NECO STATE OFFICE, SOKOTO",SOKOTO,,,,,
018,Kogi,0182385,"UBE/JSS FELELE, LOKOJA",,,,,,,,
018,Kogi,0182386,"DE-WISDOM SEC. SCHOOL, ZARIAGI",,,,,,,,
003,Akwa Ibom,0034018,"REDEEMER INTERNATIONAL SCHOOLS, UYO",03001,"NECO STATE OFFICE, UYO",UYO,,,,,
018,Kogi,0182387,UBE/JSS BANDA,,,,,,,,
030,Yobe,0303090,FEDERAL COLLEGE OF EDUCATION.(TECHINAL) DEMONSTRATION SEC. SCHL.,30001,"FIRST BANK PLC, POTISKUM",POTISKUM,,,,,
005,Bauchi,0052586,"GOVT JUNIOR SEC. SCHOOL, K/WARJI",,,,,,,,
002,Adamawa,0020279,"ALIYU MUSTAFA  ACADEMY, YOLA",02009,"UNION BANK PLC, JIMETA",JIMETA,,,,,
005,Bauchi,0052587,"GOVT JUNIOR SEC. SCHOOL, MALAR BOGORO",,,,,,,,
005,Bauchi,0052588,GDJSS DAGAUDA,,,,,,,,
005,Bauchi,0052589,"MODEL JUNIOR SEC. SCHOOL, DAMBAM",,,,,,,,
010,Edo,0100603,"FEDERAL SCIENCE AND TECHNICAL COLLEGE, UROMI",10002,"POLICE STATION, UROMI",UROMI,,,,,
005,Bauchi,0052590,GSS BAYAN BANKAI,,,,,,,,
031,FCT,0318009,"NKOYO SQUARE SCHOOLS, DEI-DEI, ABUJA",31008,"POLICE STATION, BYAZHINE, KUBWA","BYAZHINE, KUBWA",,,,,
031,FCT,0318017,"ROZ ACADEMY, ASOKORO EXTENSION, ABUJA",31017,"FIRST BANK, ASOKORO",ASOKORO,,,,,
031,FCT,0318335,"SOUND FOUNDATION SCHOOLS, WARU APO, ABUJA",,,,,,,,
031,FCT,0318377,"FRANKVILLE LEARNING ACADEMY. LIFE CAMP, ABUJA",,,,,,,,
005,Bauchi,0052591,GJSS ALKALERI,,,,,,,,
005,Bauchi,0052592,GJSS GWARAM,,,,,,,,
005,Bauchi,0052593,UBE JSS BAJAMA,,,,,,,,
005,Bauchi,0052594,JSS ALKALERI,,,,,,,,
005,Bauchi,0052601,GJSS GAMBAR LERE,,,,,,,,
018,Kogi,0182470,UBE/JSS ESOMI OHAINA OKENE,,,,,,,,
018,Kogi,0182471,"INSTITUTE FOR ARABIC STUD., OKENE IRUVUCHINOMI ADAVI",,,,,,,,
035,Gombe,0353584,"THE APOSTOLIC CHURCH SECONDARY SCHOOL, GOMBE",35001,"NECO STATE OFFICE, GOMBE",GOMBE,,,,,
036,Nasarawa,0363982,"PEOPLE'S COMPREHENSIVE ACADEMY, MARARABA GURKU",36010,"POLICE STATION A DIVISION, MARARABA GURKU",MARARABA GURKU,,,,,
036,Nasarawa,0366086,"PECUTY ROYAL INTERNATIONAL ACADEMY, MARARABA",36004,"POLICE STATION, NEW NYANYA",NEW NYANYA,,,,,
036,Nasarawa,0368385,"SKIDO KIDS ACADEMY, DAGBANA",,,,,,,,
071,EQUITORIA GUINEA,0711002,"GLORYLAND HIGH SCHOOL, MALABO",71001,"NIGERIAN EMBASSY MALABO, EQUATORIAL GUINEA",MALABO,,,,,
019,Kwara,0190838,NANA AISAT MEMORIAL COLLEGE,19001,"NECO OFFICE, ILORIN",ILORIN,,,,,
005,Bauchi,0050714,"ECWA KAUNA SECONDARY SCHOOL, BAUCHI",05002,FED. MIN. OF LABOUR AND PROD.(skills acquisition c,BAUCHI,,,,,
027,Rivers,0274356,"LINTEL  INTERNATIONAL SCHOOL,  PORT- HARCOURT",27027,"INTELLECTUAL GAINT CHRISTIAN SCHOOL, WOJI",WOJI,,,,,
027,Rivers,0274693,"FAITH INTERNATIONAL SECONDARY SCHOOL, PORTHARCOURT",27027,"INTELLECTUAL GAINT CHRISTIAN SCHOOL, WOJI",WOJI,,,,,
027,Rivers,0276189,"PAWA INTERNATIONAL SCHOOLS, WOJI, PORT HARCOURT",27027,"INTELLECTUAL GAINT CHRISTIAN SCHOOL, WOJI",WOJI,,,,,
022,Ogun,0220788,CROWN COLLEGE ABEOKUTA,22015,"SOLID ROCK MICROFINANCE BANK, IFO",IFO,,,,,
025,Oyo,0257937,"3BS COLLEGE ABASO, IBADAN",25005,"POLICE STATION, AKOBO I",AKOBO,,,,,
001,Abia,0010632,"THE MASTER'S VESSEL CLASSICAL ACADEMY, UMUAHIA",01001,"NECO OFFICE, UMUAHIA",UMUAHIA,,,,,
001,Abia,0011076,"ADVENTIST SECONDARY TECHNICAL COLLEGE, OWERRINTA",01004,ZIE ABA SOUTH,ABA SOUTH,,,,,
001,Abia,0011077,"DIVINE GRACE INTERNATIONAL SECONDARY SCHOOL, ABA",01004,ZIE ABA SOUTH,ABA SOUTH,,,,,
020,Lagos,0208258,"EBIERE COLLEGE, OJO, LAGOS",20009,"DIVISIONAL POLICE STATION, OKOKOMAIKO",OKOKOMAIKO,,,,,
001,Abia,0013287,"MICHEAL OPARA UNIV OF AGRICULTURE INTERNATIONAL SECONDARY SCHOOL, UMUDIKE",01001,"NECO OFFICE, UMUAHIA",UMUAHIA,,,,,
001,Abia,0014101,"CHRISTLAND MISSION SECONDARY SCHOOL, UMUAHIA",01001,"NECO OFFICE, UMUAHIA",UMUAHIA,,,,,
001,Abia,0014282,"PRAISE-EL GIBOR INTERNATIONAL SECONDARY SCHOOL, ABA UMUCHICHI",01004,ZIE ABA SOUTH,ABA SOUTH,,,,,
001,Abia,0014283,"JEN-EDITH INTERNATIONAL ACADEMY, OBUZOR ASA",01005,"A.I.E, OBEHIE",OBEHIE,,,,,
001,Abia,0014523,"GOLDAN INTERNATIONAL SECONDARY SCHOOL, IKWUANO UMUAHIA",01001,"NECO OFFICE, UMUAHIA",UMUAHIA,,,,,
001,Abia,0014527,"STANDARD INTERNATIONAL SECONDARY SCHOOL, UMUAHIA",01001,"NECO OFFICE, UMUAHIA",UMUAHIA,,,,,
001,Abia,0014715,"ST. CECILIA'S ACADEMY, UMUAHIA",01001,"NECO OFFICE, UMUAHIA",UMUAHIA,,,,,
001,Abia,0014716,"MARIGOLD MONTESSORI SECONDARY SCHOOL, UMUAHIA",01001,"NECO OFFICE, UMUAHIA",UMUAHIA,,,,,
001,Abia,0015733,"HIGHER GROUND INTERNATIONAL SCHOOLS, UZUAKOLI",01001,"NECO OFFICE, UMUAHIA",UMUAHIA,,,,,
001,Abia,0016090,"VEMA PARAGON ACADEMY, OLOKORO, UMUAHIA",01001,"NECO OFFICE, UMUAHIA",UMUAHIA,,,,,
001,Abia,0016512,"HOMESTEAD ALTERNATIVE ACADEMY, ELUAMA ISUIKWUATO",01006,"SUB-TREASURY, ISUIKWUATO",ISUIKWUATO,,,,,
001,Abia,0017750,"DORITY INTERNATIONAL EARLY LEARNING SCHOOL, ABA",01004,ZIE ABA SOUTH,ABA SOUTH,,,,,
002,Adamawa,0020215,"CONCORDIA COLLEGE, YOLA",02009,"UNION BANK PLC, JIMETA",JIMETA,,,,,
002,Adamawa,0020700,"INTERNATIONAL COMPREHENSIVE SCHOOL, MUBI",02003,"EMIR'S PALACE, MUBI",MUBI,,,,,
002,Adamawa,0020839,"EL-SHADAI MODEL SCHOOL, YOLA",02001,"NECO OFFICE, YOLA",YOLA,,,,,
002,Adamawa,0020844,IQRA ACADEMY YOLA,02001,"NECO OFFICE, YOLA",YOLA,,,,,
002,Adamawa,0021131,LIGHT OF LIFE ACADEMY,,,,,,,,
002,Adamawa,0021146,"BIBLE HERITAGE LIFE COLLEGE, YOLA",02001,"NECO OFFICE, YOLA",YOLA,,,,,
002,Adamawa,0021257,"FEDERAL POLYTECH.STAFF SCHOOL, MUBI",02003,"EMIR'S PALACE, MUBI",MUBI,,,,,
002,Adamawa,0021258,"NADI INTERNATIONAL SCHOOL, YOLA",02001,"NECO OFFICE, YOLA",YOLA,,,,,
002,Adamawa,0021427,"ASSEMBLIES OF GOD ACADEMY, JIMETA, YOLA",02009,"UNION BANK PLC, JIMETA",JIMETA,,,,,
002,Adamawa,0021428,"USMAN BARKONO ACADEMY, YOLA",02001,"NECO OFFICE, YOLA",YOLA,,,,,
002,Adamawa,0021669,REMI EDUCATIONAL FOUNDATION COLLEGE,02002,"LOCAL EDUCATION COUNCIL, YOLA TOWN",YOLA,,,,,
002,Adamawa,0021674,"HALIBARTH ENGLISH COLLEGE, MUBI",02003,"EMIR'S PALACE, MUBI",MUBI,,,,,
002,Adamawa,0021677,"F.A.A.N. STAFF ACADEMY, YOLA",02009,"UNION BANK PLC, JIMETA",JIMETA,,,,,
002,Adamawa,0021866,"ST.PATRICK'S ACADEMY,GRA,NUMAN ADAMAWA STATE",02004,"UNITY BANK PLC, NUMAN",NUMAN,,,,,
002,Adamawa,0021867,"UPPER BENUE STAFF SCH.MBABMA FUFORE RD,YOLA.",02002,"LOCAL EDUCATION COUNCIL, YOLA TOWN",YOLA,,,,,
002,Adamawa,0021868,ISALI INTER. ACADEMY LAMIN ZUBAIRU BYE PASS YOLA,02002,"LOCAL EDUCATION COUNCIL, YOLA TOWN",YOLA,,,,,
002,Adamawa,0023157,"EKKLESIYA YANUWA A NIGERIA, (E.Y.N) ACADEMY,  JIMETA",02009,"UNION BANK PLC, JIMETA",JIMETA,,,,,
002,Adamawa,0023169,"AREWA ACHIEVER'S ACADEMY, YOLA",02002,"LOCAL EDUCATION COUNCIL, YOLA TOWN",YOLA,,,,,
002,Adamawa,0023171,"ADVENTIST SECONDARY SCHOOL, NUMAN",02004,"UNITY BANK PLC, NUMAN",NUMAN,,,,,
002,Adamawa,0023309,"USMANIYA COLLEGE FOR ARABIC AND ISLAMIC EDUCATION, YOLA",02001,"NECO OFFICE, YOLA",YOLA,,,,,
002,Adamawa,0023587,"BILSAG UNIQUE INTERNATIONAL ACADEMY, JIMETA-YOLA",02001,"NECO OFFICE, YOLA",YOLA,,,,,
002,Adamawa,0024103,"KIM STANDARD FOUNDATION SCHOOL, JIMETA",02001,"NECO OFFICE, YOLA",YOLA,,,,,
002,Adamawa,0024285,"HALIBERTH SCIENCE COLLEGE, MUBI",02003,"EMIR'S PALACE, MUBI",MUBI,,,,,
002,Adamawa,0024451,"INSPIRE PARADIGM ACADEMY, JIMETA YOLA",02001,"NECO OFFICE, YOLA",YOLA,,,,,
002,Adamawa,0025734,"FUTURE STARS COLLEGE,WAURU JABBE, YOLA",02009,"UNION BANK PLC, JIMETA",JIMETA,,,,,
002,Adamawa,0025735,"ADROIT INTERNATIONAL ACADEMY, WURO HAUSA, YOLA",02002,"LOCAL EDUCATION COUNCIL, YOLA TOWN",YOLA,,,,,
002,Adamawa,0025835,"NOBLE INTELLECT ACADEMY, KOFARE, JIMETA",02009,"UNION BANK PLC, JIMETA",JIMETA,,,,,
002,Adamawa,0025836,"EXCELLENT WISDOM ACADEMY, NGBALANG",02004,"UNITY BANK PLC, NUMAN",NUMAN,,,,,
002,Adamawa,0026095,"OUR LADY OF CONSOLATION SECONDERY SCHOOL, BAZZA",02007,"POLICE STATION, MICHIKA",MICHIKA,,,,,
002,Adamawa,0026416,"GREATER FUTURE ACADEMY, SANGERE GOMBI",02008,"FIRST BANK PLC, GOMBI",GOMBI,,,,,
002,Adamawa,0026514,"FIRST BAPTIST JUNIOR SECONDARY SCHOOL, DIRBISHI",02003,"EMIR'S PALACE, MUBI",MUBI,,,,,
002,Adamawa,0026515,"HOSSANA GROUP OF SCHOOLS, SANGERE FUTY",02010,"COMMUNITY BANK, GIREI",GIREI,,,,,
003,Akwa Ibom,0030505,"FULGA INTERNATIONAL COLLEGE, MBIABAM",03001,"NECO STATE OFFICE, UYO",UYO,,,,,
003,Akwa Ibom,0030876,"TOUCHSTONE HIGH SCHOOL, IKOT OKUDOMO, EKET",03003,"ZONAL EDUCATION OFFICE - LIVERPOOL ROAD, EKET",EKET,,,,,
003,Akwa Ibom,0030921,"ALFRED'S SCIENCE & COMPUTER SCHOOL, IKA",03008,"SUB TREASURY, IKA",IKA,,,,,
003,Akwa Ibom,0031113,"HOPE POWER COLLEGE, OKON EKET",03013,"SUB-TREASURY, IKOT EDIBON",IKOT EDBON,,,,,
003,Akwa Ibom,0031154,"ROYAL PEARLS COLLEGE, UYO",03001,"NECO STATE OFFICE, UYO",UYO,,,,,
003,Akwa Ibom,0031155,"GRACELAND HIGH SCHOOL, EWET HOUSING  ESTATE, UYO",03001,"NECO STATE OFFICE, UYO",UYO,,,,,
003,Akwa Ibom,0031156,DE TRIO  SECONDARY  SCHOOL,03002,"SUB-TREASURY, IKOT-EKPENE",IKOT-EKPENE,,,,,
003,Akwa Ibom,0031395,"ALL WEATHER SCHOOL, IDUA EKET",03003,"ZONAL EDUCATION OFFICE - LIVERPOOL ROAD, EKET",EKET,,,,,
003,Akwa Ibom,0031753,"NEW ERA HIGH SCHOOL, EKET",03003,"ZONAL EDUCATION OFFICE - LIVERPOOL ROAD, EKET",EKET,,,,,
003,Akwa Ibom,0031815,HERITAGE COLL.UYO,03001,"NECO STATE OFFICE, UYO",UYO,,,,,
003,Akwa Ibom,0031860,"HERITAGE COLLEGE, NSIKAK EDUOK AVENUE, UYO",03001,"NECO STATE OFFICE, UYO",UYO,,,,,
003,Akwa Ibom,0031861,"SCRIPTURE UNION SECONDARY SCHOOL, UYO",03001,"NECO STATE OFFICE, UYO",UYO,,,,,
003,Akwa Ibom,0031863,"AUNTY CHINNY'S INTERNATIONAL HIGH SCHOOL, EKET",03003,"ZONAL EDUCATION OFFICE - LIVERPOOL ROAD, EKET",EKET,,,,,
003,Akwa Ibom,0032946,"REVELATION SECONDARY SCHOOL, EKET",03003,"ZONAL EDUCATION OFFICE - LIVERPOOL ROAD, EKET",EKET,,,,,
003,Akwa Ibom,0032947,"BLESSED FOUNDATION COLLEGE, AWA IMAN",03003,"ZONAL EDUCATION OFFICE - LIVERPOOL ROAD, EKET",EKET,,,,,
003,Akwa Ibom,0033158,"ROYAL COMPREHENSIVE COLLEGE, ORON",03005,"SUB -TREASURY, ORON",ORON,,,,,
018,Kogi,0182512,UBE/JSS IFFE AND IKOYI,,,,,,,,
003,Akwa Ibom,0034107,"FELLOWSHIP HIGH SCHOOL, UYO",03012,"AKS COUNCIL FOR ARTS & CULTURE, ABAK ROAD, UYO","ABAK ROAD, UYO",,,,,
003,Akwa Ibom,0034108,"DIVINE ACADEMY, EKET",03003,"ZONAL EDUCATION OFFICE - LIVERPOOL ROAD, EKET",EKET,,,,,
003,Akwa Ibom,0034286,"ROYAL NEFSEA INTERNATIONAL SCHOOLS, IKOT NTUEN NSIT",03012,"AKS COUNCIL FOR ARTS & CULTURE, ABAK ROAD, UYO","ABAK ROAD, UYO",,,,,
003,Akwa Ibom,0034287,"GREATER GRACE SECONDARY SCHOOL, ITU",03001,"NECO STATE OFFICE, UYO",UYO,,,,,
003,Akwa Ibom,0034364,"SAINT ANNIE CHRISTIAN COLLEGE, OBIO NDOT",03006,"SUB-TREASURY, ABAK",ABAK,,,,,
003,Akwa Ibom,0034366,"HOPELAND PRIME SCHOOLS, UYO",03009,"METHODIST CHURCH, BIG IFA, ATAI",ATAI,,,,,
003,Akwa Ibom,0034453,"AWIN INTERNATIONAL SCHOOLS, UKPAP EKPAN ITAK, IKONO",03012,"AKS COUNCIL FOR ARTS & CULTURE, ABAK ROAD, UYO","ABAK ROAD, UYO",,,,,
003,Akwa Ibom,0034456,"ESSENCE SCHOOLS, NUNG-UYO",03012,"AKS COUNCIL FOR ARTS & CULTURE, ABAK ROAD, UYO","ABAK ROAD, UYO",,,,,
003,Akwa Ibom,0034106,"BAYAM INTERNATIONAL SECONDARY SCHOOL, UYO",03015,"ZONAL EDUCATION OFFICE, MBABA AFIA STREET",UYO,,,,,
003,Akwa Ibom,0034721,"BRIGHT HOPE CHRISTIAN ACADEMY, IKOT NTUK, ORUK ANAM",03010,"SUB-TREASURY, IKOT IBRITAM, ORUK ANAM",ORUK ANAM,,,,,
003,Akwa Ibom,0034723,"AUNTY BASSEY SECONDARY SCHOOL, MBIAOBONG ETOI UYO",03009,"METHODIST CHURCH, BIG IFA, ATAI",ATAI,,,,,
003,Akwa Ibom,0034724,"EXTRA GRACE COLLEGE, MBIAOBONG IKOT ESSIEN UYO",03009,"METHODIST CHURCH, BIG IFA, ATAI",ATAI,,,,,
003,Akwa Ibom,0034726,"THOMAN INTERNATIONAL SCHOOLS, IKOT IKPE, OKON EKET",03003,"ZONAL EDUCATION OFFICE - LIVERPOOL ROAD, EKET",EKET,,,,,
003,Akwa Ibom,0034728,"FORESIGHT INTERNATIONAL ACADEMY, IKOT AKPAN ABIA, IKOT- EKPENE",03002,"SUB-TREASURY, IKOT-EKPENE",IKOT-EKPENE,,,,,
003,Akwa Ibom,0034977,"WISDOM COMPREHENSIVE SECONDARY SCHOOL, UYO",03001,"NECO STATE OFFICE, UYO",UYO,,,,,
003,Akwa Ibom,0035304,"EMMANUEL NEW LIFE INTERNATIONAL COLLEGE, ABIAKPO IKOT ESSIEN, IKOT EKPENE",03002,"SUB-TREASURY, IKOT-EKPENE",IKOT-EKPENE,,,,,
003,Akwa Ibom,0035843,"HARRY HAIGH SCHOOLS, EKET",03003,"ZONAL EDUCATION OFFICE - LIVERPOOL ROAD, EKET",EKET,,,,,
003,Akwa Ibom,0035845,"GREYSONS FOUNDATION ACADEMY,  IKOT MBONDE, ITU",03001,"NECO STATE OFFICE, UYO",UYO,,,,,
003,Akwa Ibom,0036230,"BEST LIFE NOBLE HIGH SCHOOL, ORON",03005,"SUB -TREASURY, ORON",ORON,,,,,
003,Akwa Ibom,0036231,"COMMUNITY SECONDARY SCHOOL, MBIABONG EDEM EDIK, IBIONO IBOM",03012,"AKS COUNCIL FOR ARTS & CULTURE, ABAK ROAD, UYO","ABAK ROAD, UYO",,,,,
003,Akwa Ibom,0036236,"NEST B ACADEMY, IKOT OKU IKONO,UYO",03012,"AKS COUNCIL FOR ARTS & CULTURE, ABAK ROAD, UYO","ABAK ROAD, UYO",,,,,
003,Akwa Ibom,0036419,"THE GREAT SHEPHERD HIGH SCHOOL, ABIAKPO IKOT ABASI INYANG, OBOT AKARA",03007,"SUB-TREASURY, OBOT-AKARA",OBOT AKARA,,,,,
018,Kogi,0182554,UBE/JSS TAKETE-IDE,,,,,,,,
003,Akwa Ibom,0036526,"SUCCESS CROWN INTERNATIONAL SCHOOL, IKOT EKPUK, ITAM ITU",03012,"AKS COUNCIL FOR ARTS & CULTURE, ABAK ROAD, UYO","ABAK ROAD, UYO",,,,,
003,Akwa Ibom,0036781,"ARENA STAR SCHOOLS, UDOUSORO ANUA OBIO, UYO",03012,"AKS COUNCIL FOR ARTS & CULTURE, ABAK ROAD, UYO","ABAK ROAD, UYO",,,,,
003,Akwa Ibom,0036782,"BRAINHALL INTERNATIONAL SECONDARY SCHOOL, IKOT ADA UTOR, ESSIEN UDIM",03002,"SUB-TREASURY, IKOT-EKPENE",IKOT-EKPENE,,,,,
003,Akwa Ibom,0036784,"EMMANUEL BASIC INTERNATIONAL COLLEGE, NUNG IDIO EDIENE, IKONO",03012,"AKS COUNCIL FOR ARTS & CULTURE, ABAK ROAD, UYO","ABAK ROAD, UYO",,,,,
003,Akwa Ibom,0037754,"COMMUNITY HIGH SCHOOL, UYA-ORO, ORON",03005,"SUB -TREASURY, ORON",ORON,,,,,
003,Akwa Ibom,0037757,"HAVILAH HIGH SCHOOL, IKOT OKORO ROAD, ABAK",03006,"SUB-TREASURY, ABAK",ABAK,,,,,
003,Akwa Ibom,0038394,"EKPIRI-NSUKARA OFFOT HIGH SCHOOL, UYO",,,,,,,,
003,Akwa Ibom,0038177,"SCRIPTURE UNION INTERNATIONAL SECONDARY SCHOOL, IKOT ABIA, EKET",03003,"ZONAL EDUCATION OFFICE - LIVERPOOL ROAD, EKET",EKET,,,,,
003,Akwa Ibom,0038170,"FORTRESS HIGH SCHOOL INTERNATIONAL, NEAR ABIAKU CHIEF COMPOUND, UYO",03009,"METHODIST CHURCH, BIG IFA, ATAI",ATAI,,,,,
003,Akwa Ibom,0038172,"GOD'S OPINION HIGH SCHOOL, EKIT ITAM, UYO",03012,"AKS COUNCIL FOR ARTS & CULTURE, ABAK ROAD, UYO","ABAK ROAD, UYO",,,,,
003,Akwa Ibom,0038176,"WELLS INTERNATIONAL SCHOOLS, IKOT INYANG ETI, NSIT UBIUM",03013,"SUB-TREASURY, IKOT EDIBON",IKOT EDBON,,,,,
003,Akwa Ibom,0037758,"NAZARETH ACADEMY, MBIAKPA IBAHASI, INI",03014,"SUB TREASURY, INI",INI,,,,,
003,Akwa Ibom,0037762,"VOICE OF FREEDOM SCHOOLS AND VOCATIONALTRAINING ACADEMY, IBIAKPAN,OBOT AKARA",03016,"SUB TREASURY, ESSIEN UDIM",ESSIEN UDIM,,,,,
004,Anambra,0041554,"DIVINE ROYAL INTERNATIONAL COLLEGE, NKPOR",04004,"UBN BRITH STREET, ONITSHA",ONITSHA,,,,,
004,Anambra,0041704,"ST. PAUL'S UNIVERSITY SECONDARY SCHOOL, NISE",04001,"NECO OFFICE , AWKA",AWKA,,,,,
004,Anambra,0041715,"FED. GOVT. COLLEGE STAFF SCHOOL, NISE",04001,"NECO OFFICE , AWKA",AWKA,,,,,
004,Anambra,0041716,"FEDERAL GOVERNMENT COLLEGE STAFF SCHOOL, NISE",04001,"NECO OFFICE , AWKA",AWKA,,,,,
004,Anambra,0043133,"BRITISH SPRING COLLEGE, AWKA",04001,"NECO OFFICE , AWKA",AWKA,,,,,
004,Anambra,0043134,"BISHOP CROWTHER SEMINARY, AWKA",04001,"NECO OFFICE , AWKA",AWKA,,,,,
004,Anambra,0044109,"GRACE COURT INTERNATIONAL HIGH SCHOOL, AKWA",04001,"NECO OFFICE , AWKA",AWKA,,,,,
004,Anambra,0044110,"EAGLE POWER COLLEGE OF EXCELLENCE, OBUNAGU AWKA",04001,"NECO OFFICE , AWKA",AWKA,,,,,
004,Anambra,0044460,"ST. MARY THE VIRGIN MODEL SECONDARY SCHOOL, EAST NIGER, OGBARU",,,,,,,,
004,Anambra,0044945,"DEEPER LIFE HIGH SCHOOL, DEEPER LIFE CAMP GROUND, NTEJE",04005,"ST. PAUL ANGLICAN CHURCH, NTEJE",NTEJE,,,,,
004,Anambra,0045220,"ST MICHAEL'S BOYS' SECONDARY SCHOOL, OZUBULU",04002,"ST. STEPHEN'S ANGLICAN CHURCH UMUDIM, NNEWI","UMUDIM, NNEWI",,,,,
004,Anambra,0046100,ST. CHRISTOPHER'S JUNIOR SEMINARY 3-3 ONITSHA,04004,"UBN BRITH STREET, ONITSHA",ONITSHA,,,,,
004,Anambra,0047763,"BLUE SKY ACADEMY SECONDARY SCHOOL, ODUME OBOSI",04004,"UBN BRITH STREET, ONITSHA",ONITSHA,,,,,
004,Anambra,0047766,"PETRA COLLEGE, AWKA",04001,"NECO OFFICE , AWKA",AWKA,,,,,
004,Anambra,0048043,"HOLY FAMILY SECONDARY SCHOOL, IGBOUKWU",,,,,,,,
004,Anambra,0048044,"LITTLE ANGEL BRITISH SECONDARY SCHOOL, AGULERI",,,,,,,,
004,Anambra,0048047,"MERCIL INNOVATIVE COLLEGE, OBOSI",,,,,,,,
004,Anambra,0048051,"ST. CHARLES BORROMEO SECONDARY SCHOOL, OBOSI",,,,,,,,
005,Bauchi,0050126,"COMMUNITY GIRLS SECONDARYSCHOOL,DARAZO",,,,,,,,
005,Bauchi,0050127,HAMMAYO VOCATIONAL CENTRE & SCHOOLS,,,,,,,,
005,Bauchi,0050128,"GOV'T DAY SECOMDARYSCHOOL,TULU",,,,,,,,
005,Bauchi,0050129,"COMMUNITY DAY SECONDARY SCHOOL,NABARDO",,,,,,,,
004,Anambra,0048054,"UNIQUE ANGELS CHRISTIAN COLLEGE, IHIALA",04003,"GRUNDTVING POLYTECHNIC, OBA",OBA,,,,,
005,Bauchi,0050073,"DEMONSTRATION SECONDARY SCHOOL, COLLEGE OF EDUCATION (C.O.E.) , AZARE",05003,"UNITY BANK PLC,AZARE",AZARE,,,,,
005,Bauchi,0050925,"GOVT. COLLEGE,TORO",,,,,,,,
005,Bauchi,0050926,GOVT. GIRLS' COLLEGE K/MADAKI,,,,,,,,
005,Bauchi,0050927,"GOVT.COLLEGE,AZARE",,,,,,,,
005,Bauchi,0050929,"KINGS INTERNATIONAL SECONDARY SCHOOL, BAUCHI",05001,"NECO STATE OFFICE, BAUCHI",BAUCHI,,,,,
005,Bauchi,0050931,"FOMWAN MODEL SECONDARY SCHOOL, BAUCHI",05001,"NECO STATE OFFICE, BAUCHI",BAUCHI,,,,,
005,Bauchi,0050972,JIBRIL AMINU MODEL JUNIOR SEC. SCH. BAUCHI,,,,,,,,
005,Bauchi,0051012,"HARMONY HIGH SCHOOL, YELWA BAUCHI",05002,FED. MIN. OF LABOUR AND PROD.(skills acquisition c,BAUCHI,,,,,
005,Bauchi,0051313,"FGC STAFF SCHOOL, AZARE",,,,,,,,
005,Bauchi,0051314,"HAVARDITH INT'L SEC. SCHOOL, FED. LOW COST, BAUCHI",05002,FED. MIN. OF LABOUR AND PROD.(skills acquisition c,BAUCHI,,,,,
005,Bauchi,0051504,"FGGC, STAFF SCHOOL, BAUCHI",,,,,,,,
005,Bauchi,0051671,"PRESENTATION BROTHER SECONDARY SCHOOL, TAFAWA BALEWA",05004,POLICE STATION TAFAWA BALEWA,TAFAWA BALEWA,,,,,
005,Bauchi,0052565,"GOVT JUNIOR SEC. SCHOOL, TAFAWA BALEWA",,,,,,,,
005,Bauchi,0051784,"ASPIRA SEC ACADEMY TUDUN-SALMANU,BAUCHI",05001,"NECO STATE OFFICE, BAUCHI",BAUCHI,,,,,
005,Bauchi,0050713,"CITY COMPREHENSIVE SEC. SCHOOL, BAUCHI",05002,FED. MIN. OF LABOUR AND PROD.(skills acquisition c,BAUCHI,,,,,
005,Bauchi,0051129,"SKY CREST HIGH SCHOOL, BAUCHI",05002,FED. MIN. OF LABOUR AND PROD.(skills acquisition c,BAUCHI,,,,,
005,Bauchi,0051315,"DOLPHINE INSTITUTE, NEW GRA, BAUCHI",05002,FED. MIN. OF LABOUR AND PROD.(skills acquisition c,BAUCHI,,,,,
005,Bauchi,0051785,"ANN'S KINGS AND QUEEN COLL,BAUCHI",05002,FED. MIN. OF LABOUR AND PROD.(skills acquisition c,BAUCHI,,,,,
005,Bauchi,0050540,"ISLAMIC ORINTATION SECONDARY SCHOOL, AZARE",05003,"UNITY BANK PLC,AZARE",AZARE,,,,,
005,Bauchi,0051765,"AL-AMIN ACADEMY, AZARE",05003,"UNITY BANK PLC,AZARE",AZARE,,,,,
005,Bauchi,0050498,"BAUCHI URBAN, COLLEGE",05001,"NECO STATE OFFICE, BAUCHI",BAUCHI,,,,,
005,Bauchi,0052568,"GOVT JUNIOR SEC. SCHOOL, BAKERI DUKKU",,,,,,,,
005,Bauchi,0052569,"GOVT JUNIOR SEC. SCHOOL, LIMBULA TAFAWA BALEWA",,,,,,,,
005,Bauchi,0052570,"GOVT JUNIOR SEC. SCHOOL, TUDUN SALMANU",,,,,,,,
005,Bauchi,0052571,"GOVT JUNIOR SEC. SCHOOL, Y/MAKARANTA",,,,,,,,
005,Bauchi,0052572,"GOVT JUNIOR SEC. SCHOOL, ZWALL",,,,,,,,
005,Bauchi,0052573,"GOVT JUNIOR SEC. SCHOOL, JOLONG BOGORO",,,,,,,,
005,Bauchi,0052575,"GOVT EC. SCHOOL, DULL",,,,,,,,
005,Bauchi,0052576,"GOVT JUNIOR SEC. SCHOOL, T/WADA MALIMA",,,,,,,,
005,Bauchi,0052577,"GOVT JUNIOR SEC. SCHOOL, BAR AREWA BOGORO",,,,,,,,
005,Bauchi,0052847,"FEDERAL POLY STAFF SECONDARY SCHOOL, GWALLAMEJI, BAUCHI",05002,FED. MIN. OF LABOUR AND PROD.(skills acquisition c,BAUCHI,,,,,
005,Bauchi,0052574,"KING & QUEEN, BOI",05005,"COCIN PASTOR'S CUSTODIAN POINT, BOI",BOI,,,,,
005,Bauchi,0053364,"TAWFIQ ACADEMY, BAUCHI",05001,"NECO STATE OFFICE, BAUCHI",BAUCHI,,,,,
005,Bauchi,0053521,"SABIL-SUNLIGHT INTERNATIONAL SCHOOL, BAUCHI",05001,"NECO STATE OFFICE, BAUCHI",BAUCHI,,,,,
005,Bauchi,0053522,"GIWO SCIENCE ACADEMY, BAUCHI",05001,"NECO STATE OFFICE, BAUCHI",BAUCHI,,,,,
005,Bauchi,0053596,"BADALA ACADEMY, AZARE",05003,"UNITY BANK PLC,AZARE",AZARE,,,,,
005,Bauchi,0053752,"LOVE PARADISE ACADEMY, BAUCHI",05002,FED. MIN. OF LABOUR AND PROD.(skills acquisition c,BAUCHI,,,,,
005,Bauchi,0053753,"AL-IMAMU SHAFI INTERNATIONAL ACADEMY, BAUCHI",05001,"NECO STATE OFFICE, BAUCHI",BAUCHI,,,,,
005,Bauchi,0054288,"INTERCONTINENTAL GRAMMAR SECONDARY SCHOOL, BAUCHI",05001,"NECO STATE OFFICE, BAUCHI",BAUCHI,,,,,
005,Bauchi,0054383,"BETHEL VICTORY INTERNATIONAL SCHOOL, BAUCHI",05002,FED. MIN. OF LABOUR AND PROD.(skills acquisition c,BAUCHI,,,,,
005,Bauchi,0054582,"EL-SADIQ INTERNATIONAL ACADEMY, BAUCHI",05001,"NECO STATE OFFICE, BAUCHI",BAUCHI,,,,,
