state_code,state_name,sch_num,sch_name,cust_code,cust_name,cust_town,status,type,category,accd_year,lga
018,Kogi,0183099,GOVERNMENT MODEL SECONDARY SCHOOL ETTE,,,,,,,,
018,Kogi,0183100,"GOD'S TIME SECONDARY SCHOOL,OBAJANA",18011,"POLICE STATION, OBAJANA",OBAJANA,,,,,
018,Kogi,0183101,"ATODO INTERNATIONAL ACADEMY ALLOR,ANKPA",,,,,,,,
018,Kogi,0183102,ST.UDILE ROYAL COMPUTER TECH.& SEC.SCHOOL IDAH,,,,,,,,
018,Kogi,0183103,"BISHOP CROWTHER MEMORIAL COLLEGE,IDAH",,,,,,,,
018,Kogi,0183104,"EMODU COMMUNITY SECONDARY SCHOOL,OFABO",,,,,,,,
018,Kogi,0183105,UBE/JSS OLOWA ETIAJA,,,,,,,,
018,Kogi,0183106,GSS ILUKE,,,,,,,,
018,Kogi,0183108,UBE/JSS ODO-ERE,,,,,,,,
018,Kogi,0183109,"YMC SECONDARY SCHOOL,ANKPA",,,,,,,,
018,Kogi,0183110,"LORD'S COMPRE.MODERN SCIENCE COLLEGE,IDAH",,,,,,,,
018,Kogi,0183111,"MORAL GROUP OF SCHOOLS, NAGAZI EBA",,,,,,,,
018,Kogi,0183112,UKA SECONDARY SCHOOL OZURI,,,,,,,,
018,Kogi,0183113,UBE/JSS EBOYI- IGAH,,,,,,,,
018,Kogi,0183114,"OLLAH COMMUNITY SECONDARY SCHOOL,OLLAH",,,,,,,,
018,Kogi,0183115,UBE/JSS AGOJEJU AJOCHEJI,,,,,,,,
018,Kogi,0183116,OMA OYIKO INTERNATIONAL COLLEGE GANAJA,,,,,,,,
018,Kogi,0183117,"ROYAL GROWN INTERNATIONAL SECONDARY SCHOOL,LOKOJA",,,,,,,,
018,Kogi,0183118,ST.PAUL'S UBE/JSS OHAKITI KABBA,,,,,,,,
018,Kogi,0183119,ANKPA LOCAL GOVERNMENT MODEL DAY SEC.SCHOOL OFUGO,,,,,,,,
018,Kogi,0183120,UBE/JSS AJONIGBELEGWU,,,,,,,,
018,Kogi,0183121,GOVERNMENT SECONDARY SCHOOL INYE,,,,,,,,
018,Kogi,0183122,HARMONY SECONDARY SCHOOL AYEGUNLE GBEDE,,,,,,,,
018,Kogi,0183123,GOVERNMENT SPECIAL SCIENCE COLLEGE AJAKA,,,,,,,,
018,Kogi,0183124,UBE/JSS IGEBIJE,,,,,,,,
018,Kogi,0183139,IN CHRIST FOR CHRIST SECONDARY SCHOOL ZARIAGI,18011,"POLICE STATION, OBAJANA",OBAJANA,,,,,
018,Kogi,0183140,UBE/JSS EROKO,,,,,,,,
018,Kogi,0183141,UBE/JSS BAGAJI ODO,,,,,,,,
018,Kogi,0183142,"BABANAWA COLLEGE,IKEJE",,,,,,,,
018,Kogi,0183143,COMPREHENSIVE HIGH SCHOOL OKE-OFFIN,,,,,,,,
018,Kogi,0183144,UBE/JSS II EKIRIN HODE,,,,,,,,
018,Kogi,0183145,JEPHTA ACADEMY OGODO,,,,,,,,
018,Kogi,0183146,UEC SECONDARY SCHOOL ETIAFORGAMGAM,,,,,,,,
018,Kogi,0183147,"AMAKA COMMUNITY HIGH SCHOOL,AMAKA",,,,,,,,
018,Kogi,0183148,COMMUNITY SECONDARY SCHOOL ASENI,,,,,,,,
018,Kogi,0183149,UBE/JSS APATA,,,,,,,,
018,Kogi,0183150,OKEHI COMMUNITY SCIENCE EIKA-OHIZENYI,,,,,,,,
018,Kogi,0183151,UBE/JSS EMONOJI OGUGU,,,,,,,,
018,Kogi,0183264,"BRIGHT ACADEMY, OKENE",,,,,,,,
018,Kogi,0183265,"UPPERROOM INTERNATIONAL SCHOOL, IDAH",18004,UBA IDAH,IDAH,,,,,
018,Kogi,0183266,"LIVINGSTONE EXCELLENT HIGH SCHOOL, ANYIGBA",,,,,,,,
018,Kogi,0183267,"SHETTIMA QUINTESSENCE SECONDARY SCHOOL, LOKOJA",18001,"NECO OFFICE, LOKOJA",LOKOJA,,,,,
018,Kogi,0183328,"BASIC INTERNATIONAL COLLEGE, OKO OLA QUARTERS, KOGI",,,,,,,,
018,Kogi,0183329,"KINGS GRACE ACADEMY, LOKOJA",,,,,,,,
018,Kogi,0183370,"MARAB VICTORY CHILDREN'S ACADEMY, OBAJANA LOKOJA",18011,"POLICE STATION, OBAJANA",OBAJANA,,,,,
018,Kogi,0183463,"ALHIKMAT SCIENCE COLLEGE, LOKOGOMA, LOKOJA",18016,POLICE STATION D DIVISION LOKOJA,LOKOJA,,,,,
018,Kogi,0183793,"LIVINGSPRING SCHOOLS, OBAJANA",18011,"POLICE STATION, OBAJANA",OBAJANA,,,,,
018,Kogi,0184036,"CONFLUENCE SCIENCE INTERNATIONAL SCHOOL, LOKOJA",18001,"NECO OFFICE, LOKOJA",LOKOJA,,,,,
018,Kogi,0184311,"HOLY GHOST COLLEGE, OKURA SAWMILL, OKURA",18013,"POLICE STATION, OKURA",OKURA,,,,,
018,Kogi,0184496,"WISE EDUCATION INTERNATIONAL SCHOOL, OTOKITI, LOKOJA",18001,"NECO OFFICE, LOKOJA",LOKOJA,,,,,
018,Kogi,0184497,"FORTUNES SCHOOLS, LOKOJA",18001,"NECO OFFICE, LOKOJA",LOKOJA,,,,,
018,Kogi,0184498,"DE-ICON STARS INTERNATIONAL SCHOOL, OGAMINANA",18002,"AKWENGWU MICROFINANCE BANK, OGAMINANA",OGAMINANA,,,,,
018,Kogi,0184641,"ST. PETER CLAVER MODEL SECONDARY SCHOOL, AKPANYA",18018,"POLICE STATION, AKPANYA",AKPANYA,,,,,
018,Kogi,0184642,"ST. PETER'S CATHOLIC SECONDARY SCHOOL, AJAOKUTA",18005,"UNION BANK, AJAOKUTA",AJAOKUTA,,,,,
018,Kogi,0186296,"EKABEL HIGH SCHOOL, UP-INACHALO, IDAH",18004,UBA IDAH,IDAH,,,,,
018,Kogi,0186456,"GLORYLAND SECONDARY SCHOOL, IDAH",18004,UBA IDAH,IDAH,,,,,
018,Kogi,0186619,"ONWARD COMPREHENSIVE ACADEMY, FELELE LOKOJA",18001,"NECO OFFICE, LOKOJA",LOKOJA,,,,,
018,Kogi,0187864,"SOLID FOUNDATION INTERNATIONAL SCHOOLS, OGUGU",18010,"POLICE STATION, OKPO",OKPO,,,,,
019,Kwara,0190163,"VICTORY COMPREHENSIVE COLLEGE, EDIDI",,,,,,,,
019,Kwara,0190225,"MODELEK COLLEGE OF ARTS AND SCIENCE, ILORIN",19002,"NIPOST, ILORIN",ILORIN,,,,,
019,Kwara,0190304,"KINSEY ACADEMY, ILORIN",,,,,,,,
019,Kwara,0190627,"DAVID AKINTOLA COLLEGE , SABO-OKE ILORIN",19002,"NIPOST, ILORIN",ILORIN,,,,,
019,Kwara,0190649,"OYELEKE MEMORIAL COLLEGE, OFFA",19006,"NIPOST, OFFA",OFFA,,,,,
019,Kwara,0190682,"S.D.A SEC. SCHOOL, OKE-ODE",,,,,,,,
019,Kwara,0190684,"SAPATI INT'L SCHOOL, ILORIN",19011,"NSCDC, AMOYO",AMOYO,,,,,
019,Kwara,0190696,LIVING TRUTH CHRIST COLLEGE INT'L,19008,"POLICE STATION, ORO",ORO,,,,,
019,Kwara,0190720,STEPHEN'S FOUNTAIN COLLEGE,19003,"POLICE STATION, SURULERE, ILORIN","SURULERE, ILORIN",,,,,
019,Kwara,0190835,"GLORIOUS VISION INT'L COLLEGE, ILORIN",19012,"POLICE STATION, EYENKORIN",EYENKORIN,,,,,
019,Kwara,0191198,"PRECIOUS GIFT INTERNATIONAL SCHOOL, ILORIN",,,,,,,,
019,Kwara,0190650,"ANGLICAN GRAMMAR SCHOOL, ILORIN",19002,"NIPOST, ILORIN",ILORIN,,,,,
019,Kwara,0191233,"BUKS INTERNATIONAL COLLEGE, OFFA",19006,"NIPOST, OFFA",OFFA,,,,,
019,Kwara,0190651,ADEOTI COLLEGE,19007,"NIPOST, OMU-ARAN",OMU-ARAN,,,,,
019,Kwara,0191485,"ADEOLA COLLEGE, OFFA",19006,"NIPOST, OFFA",OFFA,,,,,
019,Kwara,0191488,"OLUNMAWU BASIC EDUCATION SCHOOL,GRA ILORIN",19002,"NIPOST, ILORIN",ILORIN,,,,,
019,Kwara,0191686,"TAH'FIZUL QUR'AN INTERNATIONAL SCHOOL, ILORIN",19012,"POLICE STATION, EYENKORIN",EYENKORIN,,,,,
019,Kwara,0191687,"KWARA STATE COLLEGE OF EDUCATION MODEL SECONDARY SCHOOL, ORO",19008,"POLICE STATION, ORO",ORO,,,,,
019,Kwara,0191389,"DALEX ROYAL COLLEGE,SANGO, ILORIN",19001,"NECO OFFICE, ILORIN",ILORIN,,,,,
019,Kwara,0191486,"OMOWUMI MODEL BASIC SCHOOL, ILORIN",19001,"NECO OFFICE, ILORIN",ILORIN,,,,,
019,Kwara,0191492,"AJOKE MODEL COLLEGE, ILORIN",19003,"POLICE STATION, SURULERE, ILORIN","SURULERE, ILORIN",,,,,
019,Kwara,0191497,"LUMEX INTERNATIONAL COLLEGE, ILORIN",19011,"NSCDC, AMOYO",AMOYO,,,,,
019,Kwara,0191685,"OLAYEMI COMPREHENSIVE COLLEGE, ILORIN",19012,"POLICE STATION, EYENKORIN",EYENKORIN,,,,,
019,Kwara,0191830,AYOSUN COMPRE. HIGH SCH. ILORIN.,19012,"POLICE STATION, EYENKORIN",EYENKORIN,,,,,
019,Kwara,0191831,"ROYAL INTERNATIONAL COLLEGE,ILORIN.",19012,"POLICE STATION, EYENKORIN",EYENKORIN,,,,,
019,Kwara,0193028,"FUTURE LEADERS SCHOOL,OJAGBORO ILORIN",19001,"NECO OFFICE, ILORIN",ILORIN,,,,,
019,Kwara,0193029,"OUR LADY CATHOLIC SEC. SCHOOL, SANGO, ILORIN",19001,"NECO OFFICE, ILORIN",ILORIN,,,,,
019,Kwara,0193484,"BOLTEM INTERNATIONAL ACADEMY, BUDO NUHU, ILORIN",19012,"POLICE STATION, EYENKORIN",EYENKORIN,,,,,
019,Kwara,0193533,"ADRIN COLLEGE, ILORIN, KWARA STATE",19001,"NECO OFFICE, ILORIN",ILORIN,,,,,
019,Kwara,0193799,"PROMINENT CRESCENT HIGH SCHOOL, ALONG WAEC AREA OKOLOWO ILORIN",19004,"POLICE STATION, ADEWOLE, ILORIN","ADEWOLE, ILORIN",,,,,
019,Kwara,0194313,"GLORIOUS  SUCCESS COLLEGE, BUDO-EFO, ILORIN",19002,"NIPOST, ILORIN",ILORIN,,,,,
019,Kwara,0194314,"GREAT SUCCESS STEP COLLEGE, ILORIN",19003,"POLICE STATION, SURULERE, ILORIN","SURULERE, ILORIN",,,,,
019,Kwara,0194395,"AL-FURQAN  COLLEGE, GBAGBA, ILORIN",19012,"POLICE STATION, EYENKORIN",EYENKORIN,,,,,
019,Kwara,0194440,"BHUM COLLEGE OF ARTS AND SCIENCE, WARRAH ILORIN",19004,"POLICE STATION, ADEWOLE, ILORIN","ADEWOLE, ILORIN",,,,,
019,Kwara,0194444,"LEARNIUM COLLEGE, ADEWOLE, ILORIN",19004,"POLICE STATION, ADEWOLE, ILORIN","ADEWOLE, ILORIN",,,,,
019,Kwara,0194773,"NEW AIM HIGH INTERNATIONAL ACADEMY, ORA-YOKA, OMU-ARAN",19007,"NIPOST, OMU-ARAN",OMU-ARAN,,,,,
019,Kwara,0195337,"GOLDEN GEM COLLEGE, AGBABIAKA, ILORIN",19005,"NECO ZONAL OFFICE, ILORIN",ILORIN,,,,,
019,Kwara,0195379,KING?S VINE ACADEMY OMU-ARAN,19007,"NIPOST, OMU-ARAN",OMU-ARAN,,,,,
019,Kwara,0195765,"HI-CLASS STANDARD COLLEGE, AJEGUNLE AREA, OKE-ONIGBIN",19007,"NIPOST, OMU-ARAN",OMU-ARAN,,,,,
019,Kwara,0195935,"BETHEL LAND MODEL COLLEGE, OKE-AYO AREA, AMOYO",19011,"NSCDC, AMOYO",AMOYO,,,,,
019,Kwara,0195940,"AL-MUMINEEN COLLEGE, ALAGBADO, ILORIN",19001,"NECO OFFICE, ILORIN",ILORIN,,,,,
019,Kwara,0196300,"ECWA GAA-AKANBI SECONDARY SCHOOL, GOSPEL ROAD, GAA-AKANBI, ILORIN",19005,"NECO ZONAL OFFICE, ILORIN",ILORIN,,,,,
019,Kwara,0196302,"LA' MONTEREY ACADEMY,  ILORIN",19002,"NIPOST, ILORIN",ILORIN,,,,,
019,Kwara,0196628,"DONRICH MODEL COLLEGE,  ILORIN",19012,"POLICE STATION, EYENKORIN",EYENKORIN,,,,,
020,Lagos,0200307,"BEDROCK COLLEGE, SURULERE",20001,"BODE THOMAS POLICE STATION, SURULERE",SURULERE,,,,,
020,Lagos,0200309,"TENDER TOUCH COLLEGE, FESTAC",20003,"FIRST BANK PLC,FESTAC",FESTAC,,,,,
020,Lagos,0200310,"ADRAO INTERNATIONAL SCHOOL, VICTORIA ISLAND",20014,"WEMA BANK, IDOWU TAILOR, VICTORIA ISLAND",VICTORIA ISLAND,,,,,
020,Lagos,0200317,"ST. GLORIA'S COLLEGE, GRA. IKEJA",20012,"WEMA BANK, MARYLAND",MARYLAND,,,,,
020,Lagos,0200319,"CTC INTERNATION SCHOOL, IKEJA",20012,"WEMA BANK, MARYLAND",MARYLAND,,,,,
020,Lagos,0200320,"D-IVY COLLEGE, OGBA",20004,"WEMA BANK,OGBA",OGBA,,,,,
020,Lagos,0200322,"DANSOL HIGH SCHOOL, IKEJA",20004,"WEMA BANK,OGBA",OGBA,,,,,
020,Lagos,0200327,LEGACY HIGH SCHOOL,20005,"WEMA BANK, EGBEDA",EGBEDA,,,,,
020,Lagos,0200329,"ATLANMTIC HALL, POKA EPE LAGOS STATE",20019,"DIVISIONAL POLICE STATION, EPE",EPE,,,,,
020,Lagos,0200330,"IFAKO INTERNATIONAL SECONDARY SCHOOL, IJU ROAD AGEGE",20017,"DIVISIONAL POLICE STATION,RED HOUSE,IJU",FAGBA,,,,,
020,Lagos,0200331,"ZINNIA COLLEGE, IKEJA",20004,"WEMA BANK,OGBA",OGBA,,,,,
020,Lagos,0200332,VIVIAN FOWLER MEMORIAL COLLEGE,20004,"WEMA BANK,OGBA",OGBA,,,,,
020,Lagos,0200333,"DOLAND INTERNATIONAL SECONDARY SCHOOL, AKUTE",20017,"DIVISIONAL POLICE STATION,RED HOUSE,IJU",FAGBA,,,,,
020,Lagos,0200386,"TOPMOST INTERNATIONAL COMPREHENSIVE SECONDARY SCHOOL, MARYLAND",20012,"WEMA BANK, MARYLAND",MARYLAND,,,,,
020,Lagos,0200387,ASSFOOD INTERNATIONAL COLLEGE,20007,"FIRST BANK PLC,KOSOFE",KOSOFE,,,,,
025,Oyo,0251592,"DOVESEAL COLLEGE, IGBARA OKE",,,,,,,,
020,Lagos,0200391,"MARIGOLD COLLEGE, OWORO, LAGOS",20022,"DIVISIONAL POLICE STATION, BARIGA",BARIGA,,,,,
020,Lagos,0200392,"TOPMOST INTERNATIONAL COMPREHENSIVE SECONDARY SCHOOL, IPAJA, LAGOS",20021,"ULTIMATE MICROFINANCE BANK, IPAJA",IPAJA,,,,,
020,Lagos,0200393,"KRYSTAL BAL COMPREHENSIVE, COLLEGE",20012,"WEMA BANK, MARYLAND",MARYLAND,,,,,
020,Lagos,0200395,"IDEAL COMPREHENSIVE HIGH SCHOOL, OJO",20009,"DIVISIONAL POLICE STATION, OKOKOMAIKO",OKOKOMAIKO,,,,,
020,Lagos,0200421,"BELLINA COLLEGE, AKOKA YABA, LAGOS",20022,"DIVISIONAL POLICE STATION, BARIGA",BARIGA,,,,,
020,Lagos,0200448,"UNIQUE HEIGHTS JUNIOR/SENIOR HIGH SCHOOL, MAGODO",20004,"WEMA BANK,OGBA",OGBA,,,,,
020,Lagos,0200456,SHADEL INTERNATIONAL HIGH SCHOOL,20004,"WEMA BANK,OGBA",OGBA,,,,,
020,Lagos,0200472,"LIGHTHOUSE INTERNATIONAL SECONDARY SCHOOL, IKORODU",20011,"DIVISIONAL POLICE STATION, IKORODU",IKORODU,,,,,
020,Lagos,0200492,"SOUNDHOPE PRIVATE JUNIOR ACADEMY, BARUWA IPAJA",20021,"ULTIMATE MICROFINANCE BANK, IPAJA",IPAJA,,,,,
020,Lagos,0200543,"NIGERIAN TURKISH INTERNATIONAL COLLEGE, OPEBI, IKEJA",20012,"WEMA BANK, MARYLAND",MARYLAND,,,,,
020,Lagos,0200546,"APATA MEMORIAL HIGH SCHOOL, ISOLO",20015,"FIRST BANK, IYANA ISOLO",ISOLO,,,,,
020,Lagos,0200547,"STRIDE TOWER COLLEGE, LEKKI",20008,FIRST BANK PLC LEKKI,LEKKI,,,,,
020,Lagos,0200549,AUNTY AYO INTERNATIONAL SCHOOL,20014,"WEMA BANK, IDOWU TAILOR, VICTORIA ISLAND",VICTORIA ISLAND,,,,,
020,Lagos,0200550,"GOODWILL SECONDARY SCHOOL, IKORODU",20011,"DIVISIONAL POLICE STATION, IKORODU",IKORODU,,,,,
020,Lagos,0200556,"FOUNDATION UPPER STANDARD COLLEGE, ATAWGBADI",20009,"DIVISIONAL POLICE STATION, OKOKOMAIKO",OKOKOMAIKO,,,,,
020,Lagos,0200559,"SCHOOL MASTERS ACADEMY, AJAH",20024,"FIRST BANK, AJAH",AJAH,,,,,
020,Lagos,0200581,FRANCES COLLEGE,20004,"WEMA BANK,OGBA",OGBA,,,,,
020,Lagos,0200617,"TOYIBAT COMPREHENSIVE HIGH SCHOOL, GBAGADA",20022,"DIVISIONAL POLICE STATION, BARIGA",BARIGA,,,,,
020,Lagos,0200693,SANTA MARIA COLLEGE,20015,"FIRST BANK, IYANA ISOLO",ISOLO,,,,,
020,Lagos,0200727,"GEC. COMPREHENSIVE COLLEGE, MOSAN IPAJA",20021,"ULTIMATE MICROFINANCE BANK, IPAJA",IPAJA,,,,,
020,Lagos,0200729,BEULAH COMPREHENSIVECOLLEGE,20009,"DIVISIONAL POLICE STATION, OKOKOMAIKO",OKOKOMAIKO,,,,,
020,Lagos,0200777,SHESFUN COMPREHENSIVE SCHOOL,20006,"FIRST BANK PLC, IKOTUN",IKOTUN,,,,,
020,Lagos,0200815,"DE-LIGHT INTERNATIONAL SECONDARY SCHOOL, APAPA",20020,"FIRST BANK PLC, OLODI APAPA","OLODI, APAPA",,,,,
020,Lagos,0200843,"DAMTOPS INTERNATIONAL SECONDARY SCHOOL, MOROGBO",20009,"DIVISIONAL POLICE STATION, OKOKOMAIKO",OKOKOMAIKO,,,,,
020,Lagos,0200853,"ROYALBELLS COLLEGE, OTO-AWORI",20009,"DIVISIONAL POLICE STATION, OKOKOMAIKO",OKOKOMAIKO,,,,,
020,Lagos,0200854,"OPTIMUM HIGH SCHOOL, IKOLA IPAJA",20021,"ULTIMATE MICROFINANCE BANK, IPAJA",IPAJA,,,,,
020,Lagos,0200899,"PRESTIGE PRIVATE COLLEGE, AGUDA",20001,"BODE THOMAS POLICE STATION, SURULERE",SURULERE,,,,,
020,Lagos,0200946,ADTAK COLLEGE,20025,"DIVISIONAL POLICE STATION, OWUTU AGRIC,",IKORODU,,,,,
020,Lagos,0200948,GOSHEN COLLEGE,20011,"DIVISIONAL POLICE STATION, IKORODU",IKORODU,,,,,
020,Lagos,0200962,DATFORTE HIGH SCHOOL,20002,"WEMA BANK, ABULE EGBA","ABATTOIR, OKO-OBA",,,,,
020,Lagos,0200966,"TRUE-VINE COLLEGE, IKORODU",20025,"DIVISIONAL POLICE STATION, OWUTU AGRIC,",IKORODU,,,,,
020,Lagos,0200968,"YINTAB COLLEGE, IKORODU, LAGOS",20011,"DIVISIONAL POLICE STATION, IKORODU",IKORODU,,,,,
020,Lagos,0201001,"LAUREATES COLLEGE,",20015,"FIRST BANK, IYANA ISOLO",ISOLO,,,,,
020,Lagos,0201007,PENTECOST COLLEGE,20009,"DIVISIONAL POLICE STATION, OKOKOMAIKO",OKOKOMAIKO,,,,,
020,Lagos,0201031,"BEFRANK METEORIC ACADEMY, LAGOS",20009,"DIVISIONAL POLICE STATION, OKOKOMAIKO",OKOKOMAIKO,,,,,
020,Lagos,0201056,LEKKI PENNISULA COLLEGE,20008,FIRST BANK PLC LEKKI,LEKKI,,,,,
020,Lagos,0201058,SEAGATE COLLEGE,20020,"FIRST BANK PLC, OLODI APAPA","OLODI, APAPA",,,,,
020,Lagos,0201062,AL-AZIM COLEGE,20017,"DIVISIONAL POLICE STATION,RED HOUSE,IJU",FAGBA,,,,,
020,Lagos,0201063,"LEKKI PENINSULA COLLEGE, OSAPA LEKKI",20008,FIRST BANK PLC LEKKI,LEKKI,,,,,
020,Lagos,0201064,"FIDEL-MADONNA COLLEGE OF EXCELLENCE, IBADAN",20009,"DIVISIONAL POLICE STATION, OKOKOMAIKO",OKOKOMAIKO,,,,,
020,Lagos,0201065,"SEAGATE COLLEGE, APAPA",20020,"FIRST BANK PLC, OLODI APAPA","OLODI, APAPA",,,,,
020,Lagos,0201066,CRESCENT HALL INTERNATIONAL SCHOOL,20012,"WEMA BANK, MARYLAND",MARYLAND,,,,,
020,Lagos,0201070,"TOPVILLE COLLEGE, IKORODU",20025,"DIVISIONAL POLICE STATION, OWUTU AGRIC,",IKORODU,,,,,
020,Lagos,0201078,"ROCLAND SECONDARY SCHOOL, IJANIKIN",20009,"DIVISIONAL POLICE STATION, OKOKOMAIKO",OKOKOMAIKO,,,,,
020,Lagos,0201079,"GRACIOUS LEADWAY SCHOOL, IJANIKIN",20009,"DIVISIONAL POLICE STATION, OKOKOMAIKO",OKOKOMAIKO,,,,,
020,Lagos,0201080,"NODOS COLLEGE, IKORODU",20007,"FIRST BANK PLC,KOSOFE",KOSOFE,,,,,
020,Lagos,0201081,"CHAMBERS COMP. COLLEGE, AMUKOKO",20020,"FIRST BANK PLC, OLODI APAPA","OLODI, APAPA",,,,,
020,Lagos,0201082,"NOWA SECONDARY SCHOOL, NAVY TOWN, OJO",20018,"NIGERIAN NAVY BARRACKS, NAVY TOWN, SATELLITE",SATELLITE,,,,,
020,Lagos,0201083,"GOSKIA GROUP OF SCHOOL, IKORODU",20011,"DIVISIONAL POLICE STATION, IKORODU",IKORODU,,,,,
020,Lagos,0201084,"CHRISTFIELD COMPREHENSIVE COLLEGE, AGEGE",20004,"WEMA BANK,OGBA",OGBA,,,,,
020,Lagos,0201085,"OPE-OLU COMPREHENSIVE SECONDARY SCHOOL, AGEGE",20004,"WEMA BANK,OGBA",OGBA,,,,,
020,Lagos,0201086,"DYNAMIC LANDMARK COLLEGE, IKOTUN",20006,"FIRST BANK PLC, IKOTUN",IKOTUN,,,,,
020,Lagos,0201087,"WENBY'S COLLEGE, IDIMU",20006,"FIRST BANK PLC, IKOTUN",IKOTUN,,,,,
020,Lagos,0201088,"HIGHLEAD COMPREHENSIVE COLLEGE, IKORODU",20011,"DIVISIONAL POLICE STATION, IKORODU",IKORODU,,,,,
020,Lagos,0201089,"FRANMICH COLLEGE, IKORODU",20011,"DIVISIONAL POLICE STATION, IKORODU",IKORODU,,,,,
020,Lagos,0201090,"CLEMENTINE HIGH SCHOOL, ALAGBADO",20002,"WEMA BANK, ABULE EGBA","ABATTOIR, OKO-OBA",,,,,
020,Lagos,0201091,"ADEOLA MEMORIAL COLLEGE, IJU ISHAGA",20017,"DIVISIONAL POLICE STATION,RED HOUSE,IJU",FAGBA,,,,,
020,Lagos,0201092,FESTLAD COLLEGE BADAGRY EXPRESS WAY,20010,WEMA BANK BADAGRY,BADAGRY,,,,,
020,Lagos,0201093,"WAS-LAT PRIVATE COLLEGE, APONGBON",20014,"WEMA BANK, IDOWU TAILOR, VICTORIA ISLAND",VICTORIA ISLAND,,,,,
020,Lagos,0201108,"FIRST ZION HIGH SCHOOL,",20006,"FIRST BANK PLC, IKOTUN",IKOTUN,,,,,
020,Lagos,0201117,EMDEE COLLEGE OLODI-APAPA,20020,"FIRST BANK PLC, OLODI APAPA","OLODI, APAPA",,,,,
020,Lagos,0201118,LEELAND COLL.,20012,"WEMA BANK, MARYLAND",MARYLAND,,,,,
020,Lagos,0201139,KOMFOTA COLLEGE,20007,"FIRST BANK PLC,KOSOFE",KOSOFE,,,,,
020,Lagos,0201163,TOWAB HIGH SCHOOL,20006,"FIRST BANK PLC, IKOTUN",IKOTUN,,,,,
020,Lagos,0201166,HIGH  HOPE  ACADEMY SATELLITE  TOWN,20018,"NIGERIAN NAVY BARRACKS, NAVY TOWN, SATELLITE",SATELLITE,,,,,
020,Lagos,0201265,"ALDAMAK NOURAN SECONDARY SCHOOL,AJAH",20024,"FIRST BANK, AJAH",AJAH,,,,,
020,Lagos,0201267,"PRINCE HAIRS COLLEGE, MUSHIN",20015,"FIRST BANK, IYANA ISOLO",ISOLO,,,,,
020,Lagos,0201269,"LAWBON INT'L COLLEGE, IKORODU",20011,"DIVISIONAL POLICE STATION, IKORODU",IKORODU,,,,,
020,Lagos,0201345,"BRAINFIELD SCHOOL, FEDERAL HOUSING ESTATE B/STOP, LAGOS",20002,"WEMA BANK, ABULE EGBA","ABATTOIR, OKO-OBA",,,,,
020,Lagos,0201346,"KINGS ANCHOR COLLEGE, IKOTUN",20006,"FIRST BANK PLC, IKOTUN",IKOTUN,,,,,
020,Lagos,0201347,"PACESETTER ACADEMY, MEIRAN OJOKORO, LAGOS",20002,"WEMA BANK, ABULE EGBA","ABATTOIR, OKO-OBA",,,,,
020,Lagos,0201348,"PACE SETTERS ACADEMY, MEIRAN",20002,"WEMA BANK, ABULE EGBA","ABATTOIR, OKO-OBA",,,,,
020,Lagos,0201349,"EVALIGHT COLLEGE, OJO",20009,"DIVISIONAL POLICE STATION, OKOKOMAIKO",OKOKOMAIKO,,,,,
020,Lagos,0201350,"GREEN PASTURE HIGH SCHOOL, IKOTUN",20006,"FIRST BANK PLC, IKOTUN",IKOTUN,,,,,
020,Lagos,0201351,"CHRISLAND COLLEGE, LEKKI",20024,"FIRST BANK, AJAH",AJAH,,,,,
020,Lagos,0201352,"KINGS ANCHOR COLLEGE, IKOTUN",20006,"FIRST BANK PLC, IKOTUN",IKOTUN,,,,,
020,Lagos,0201353,"BRAINFIELD COLLEGE, MEIRAN",20002,"WEMA BANK, ABULE EGBA","ABATTOIR, OKO-OBA",,,,,
020,Lagos,0201360,"PACESETTERS ACADEMY, LAGOS",20002,"WEMA BANK, ABULE EGBA","ABATTOIR, OKO-OBA",,,,,
020,Lagos,0201367,"WENBY'S COLLEGE, AYODEJI AGUNLANA",20006,"FIRST BANK PLC, IKOTUN",IKOTUN,,,,,
020,Lagos,0201369,"GREEN PASTURE HIGH SCHOOL, IJEGUN",20006,"FIRST BANK PLC, IKOTUN",IKOTUN,,,,,
020,Lagos,0201442,"YESHUA HIGH SCHOOL, SABO, OYODU",20004,"WEMA BANK,OGBA",OGBA,,,,,
020,Lagos,0201444,"GLORY EMMANUEL PRIVATE SCHOOL, ORILE AGEGE",20002,"WEMA BANK, ABULE EGBA","ABATTOIR, OKO-OBA",,,,,
020,Lagos,0201445,"JOYCEVILLE COLLEGE, BADORE, AJAH",20024,"FIRST BANK, AJAH",AJAH,,,,,
020,Lagos,0201446,"P AND K HIGH SCHOOL, AMUWO ODOFIN",20003,"FIRST BANK PLC,FESTAC",FESTAC,,,,,
020,Lagos,0201461,"MURITALA MOHAMMED INTERNATIONAL SECONDARY SCHOOL, IKEJA",20012,"WEMA BANK, MARYLAND",MARYLAND,,,,,
020,Lagos,0201462,"SUPREME PILLARS COLLEGE, AGENOWO BADAGRY, LAGOS",20010,WEMA BANK BADAGRY,BADAGRY,,,,,
020,Lagos,0201478,"LANDMARK COLLEGE, OWUTU, IKORODU",20025,"DIVISIONAL POLICE STATION, OWUTU AGRIC,",IKORODU,,,,,
020,Lagos,0201494,ADE-OSHO COMPREHENSIVE COLLEGE,20022,"DIVISIONAL POLICE STATION, BARIGA",BARIGA,,,,,
020,Lagos,0201532,"FEDERAL GOVERNMENT COLLEGE STAFF JUNIOR ACADEMY, IJANIKIN, LAGOS",20009,"DIVISIONAL POLICE STATION, OKOKOMAIKO",OKOKOMAIKO,,,,,
020,Lagos,0201534,"SUPREME PILLARS COLLEGE, BADAGRY",20010,WEMA BANK BADAGRY,BADAGRY,,,,,
020,Lagos,0201538,FEDERAL GOVT. COLLEGE LAGOS STAFF JUNIOR ACADEMY,20009,"DIVISIONAL POLICE STATION, OKOKOMAIKO",OKOKOMAIKO,,,,,
020,Lagos,0201539,"MUSLIN TEEN COLLEGE BESIDE PHCN OFFICE, IJEGUN, IKOTUN",20006,"FIRST BANK PLC, IKOTUN",IKOTUN,,,,,
020,Lagos,0201549,"AUGUSTA COLLEGE,OKOKOMAIKO",20009,"DIVISIONAL POLICE STATION, OKOKOMAIKO",OKOKOMAIKO,,,,,
020,Lagos,0201550,"EVALIGHT COLLEGE, AJANGBADI",20009,"DIVISIONAL POLICE STATION, OKOKOMAIKO",OKOKOMAIKO,,,,,
020,Lagos,0201580,"LASHBOT INTERNATIONAL SCHOOL, OJOHORO, LAGOS",20002,"WEMA BANK, ABULE EGBA","ABATTOIR, OKO-OBA",,,,,
020,Lagos,0201583,"STAR FIELD COLLEGE, IJU ROAD FAGBA",20017,"DIVISIONAL POLICE STATION,RED HOUSE,IJU",FAGBA,,,,,
020,Lagos,0201630,"GILBRALTAR SECONDARY SCHOOL, OGBA",20004,"WEMA BANK,OGBA",OGBA,,,,,
020,Lagos,0201637,"JESILO HIGH SCHOOL, IKOTA HOUSING ESTATE, LEKKI",20024,"FIRST BANK, AJAH",AJAH,,,,,
020,Lagos,0201682,"ANGLICAN GIRLS' COLLEGE, KETU",20009,"DIVISIONAL POLICE STATION, OKOKOMAIKO",OKOKOMAIKO,,,,,
020,Lagos,0201695,"EMERALD COLLEGE, ILASAMAJA, OSHODI",20015,"FIRST BANK, IYANA ISOLO",ISOLO,,,,,
020,Lagos,0201699,"ALPHA REHOBOTH COLLEGE, ORISUMBARE, SHASHA",20005,"WEMA BANK, EGBEDA",EGBEDA,,,,,
020,Lagos,0201700,"JOLIBUKS HIGH SCHOOL, LAWANSON, SURULERE",20001,"BODE THOMAS POLICE STATION, SURULERE",SURULERE,,,,,
020,Lagos,0201701,"LIBERTY COLLEGE, BALOGUN-AYOBO",20021,"ULTIMATE MICROFINANCE BANK, IPAJA",IPAJA,,,,,
020,Lagos,0201703,"WELLSPRING COLLEGE, OMOLE PHASE 2, IKEJA",20004,"WEMA BANK,OGBA",OGBA,,,,,
020,Lagos,0201706,"DARMAN MODEL COLLEGE, IFAKO IJAYE",20017,"DIVISIONAL POLICE STATION,RED HOUSE,IJU",FAGBA,,,,,
020,Lagos,0201756,"CHARTERED COLLEGE, AGUNAI BUS STOP, LEKKI, LAGOS",20008,FIRST BANK PLC LEKKI,LEKKI,,,,,
020,Lagos,0201758,"FIRST OPTION COLLEGE, ABIJO-LEKKI, LAGOS",20024,"FIRST BANK, AJAH",AJAH,,,,,
020,Lagos,0201759,"ROSE OF SHARON COMPREHENSIVE COLLEGE, IBA TOWN",20009,"DIVISIONAL POLICE STATION, OKOKOMAIKO",OKOKOMAIKO,,,,,
020,Lagos,0201760,"HALIFIELD COLLEGE, MARYLAND, LAGOS",20012,"WEMA BANK, MARYLAND",MARYLAND,,,,,
020,Lagos,0201793,JIBA COLLEGE SURULERE,20001,"BODE THOMAS POLICE STATION, SURULERE",SURULERE,,,,,
020,Lagos,0201794,"G.J.S. COLLEGE, HARUNA B/STOP IKORODU",20011,"DIVISIONAL POLICE STATION, IKORODU",IKORODU,,,,,
020,Lagos,0201795,"ORISAN SECONDARY SCHOOL, ILEMBA-AWORI OJO",20009,"DIVISIONAL POLICE STATION, OKOKOMAIKO",OKOKOMAIKO,,,,,
020,Lagos,0201813,LIBERTY BELLS COLLEGE IJOYI LEKKI,20024,"FIRST BANK, AJAH",AJAH,,,,,
020,Lagos,0202383,"BASIL COLLEGE, ILUPEJU",20023,"DIVISIONAL POLICE STATION, PEDRO",SHOMOLU (ONIPANU),,,,,
020,Lagos,0202858,"PHILBETH COLLEGE, AGUNMO TOWN, LAGOS",20010,WEMA BANK BADAGRY,BADAGRY,,,,,
020,Lagos,0202860,"BARBARA COX COLLEGE, FESTAC, LAGOS",20003,"FIRST BANK PLC,FESTAC",FESTAC,,,,,
020,Lagos,0202862,"CRANE COLLEGE, SANGOTEDO, AJAH",20024,"FIRST BANK, AJAH",AJAH,,,,,
020,Lagos,0202863,"CHARISMARTIN INTERNATIONAL COLLEGE, GBAGA, IKORODU",20011,"DIVISIONAL POLICE STATION, IKORODU",IKORODU,,,,,
020,Lagos,0202865,"DEEPER LIFE HIGH SCHOOL, MOWE",20004,"WEMA BANK,OGBA",OGBA,,,,,
020,Lagos,0202987,"COVET THE REDEEMER COLLEGE, IDIMU",20005,"WEMA BANK, EGBEDA",EGBEDA,,,,,
020,Lagos,0202988,"OLUWOLE CHRIST THE KING COLLEGE, EJIGBO",20015,"FIRST BANK, IYANA ISOLO",ISOLO,,,,,
020,Lagos,0202989,"FERSCOAT COMPREHENSIVE ACADEMY, IPAJA",20021,"ULTIMATE MICROFINANCE BANK, IPAJA",IPAJA,,,,,
020,Lagos,0202990,"ZIONEEL COLLEGE, LASUNWON, IKORODU",20011,"DIVISIONAL POLICE STATION, IKORODU",IKORODU,,,,,
020,Lagos,0202991,"WONDERFUL LORD COLLEGE, KOSOFE MILE 12",20007,"FIRST BANK PLC,KOSOFE",KOSOFE,,,,,
020,Lagos,0202992,"MEADOW HALL COLLEGE, LEKKI - EPE EXPRESSWAY",20008,FIRST BANK PLC LEKKI,LEKKI,,,,,
020,Lagos,0202998,"FLORIN HIGH SCHOOL, EJIGBO",20006,"FIRST BANK PLC, IKOTUN",IKOTUN,,,,,
020,Lagos,0202999,"ROSE VALLEY HIGH SCHOOL, OKO-OBA, AGEGE",20002,"WEMA BANK, ABULE EGBA","ABATTOIR, OKO-OBA",,,,,
020,Lagos,0203000,"WOOD LAND HILLS HIGH SCHOOL, SHASHA",20005,"WEMA BANK, EGBEDA",EGBEDA,,,,,
020,Lagos,0203001,"PRIME IQRA COLLEGE,OJO",20009,"DIVISIONAL POLICE STATION, OKOKOMAIKO",OKOKOMAIKO,,,,,
020,Lagos,0203002,"MINISTERS' INTERNATIONAL COLLEGE, ISHERI",20004,"WEMA BANK,OGBA",OGBA,,,,,
020,Lagos,0203003,"MARY BENE COLLEGE, OKE-AFA, ISOLO",20015,"FIRST BANK, IYANA ISOLO",ISOLO,,,,,
020,Lagos,0203089,"DE-SHALOM MERIT COLLEGE, EGAN",20006,"FIRST BANK PLC, IKOTUN",IKOTUN,,,,,
020,Lagos,0203154,"TOTLAND SECONDARY SCHOOL, IKORODU",20025,"DIVISIONAL POLICE STATION, OWUTU AGRIC,",IKORODU,,,,,
020,Lagos,0203161,"LIBERTY COLLEGE, BALOGUN-AYOBO",20021,"ULTIMATE MICROFINANCE BANK, IPAJA",IPAJA,,,,,
020,Lagos,0203211,"SUGAR FIELD HIGH SCHOOL, LAGOS",20010,WEMA BANK BADAGRY,BADAGRY,,,,,
020,Lagos,0203212,"KUNLAP ROYAL COLLEGE, ISHERI, LAGOS",20006,"FIRST BANK PLC, IKOTUN",IKOTUN,,,,,
020,Lagos,0203282,"RODAN HIGH SCHOOL, AJAH, LAGOS",20024,"FIRST BANK, AJAH",AJAH,,,,,
020,Lagos,0203288,"DEBISLAND COLLEGE, IKORODU",20025,"DIVISIONAL POLICE STATION, OWUTU AGRIC,",IKORODU,,,,,
020,Lagos,0203302,"DUPELOLU COMPREHENSIVE COLLEGE, EGBEDA-IDIMU, LAGOS",20006,"FIRST BANK PLC, IKOTUN",IKOTUN,,,,,
020,Lagos,0203304,"UPPER GRADE COMPREHENSIVE COLLEGE OSHODI, LAGOS",20015,"FIRST BANK, IYANA ISOLO",ISOLO,,,,,
020,Lagos,0203331,"ANTIOH ROYAL COLLEGE, IKOTUN",20006,"FIRST BANK PLC, IKOTUN",IKOTUN,,,,,
020,Lagos,0203489,"FLORIDA COMPREHENSIVE COLLEGE, IJESHATEDO, LAGOS",20015,"FIRST BANK, IYANA ISOLO",ISOLO,,,,,
020,Lagos,0203499,"SAMETI INHERITANCE ACADEMY, EGBEDA",20005,"WEMA BANK, EGBEDA",EGBEDA,,,,,
020,Lagos,0203500,"EARLY HARVEST INTERNATIONAL SCHOOL, ISASHI",20009,"DIVISIONAL POLICE STATION, OKOKOMAIKO",OKOKOMAIKO,,,,,
020,Lagos,0203501,"HELEN QUEENSLEY COLLEGE, OKO-AFO, LAGOS",20010,WEMA BANK BADAGRY,BADAGRY,,,,,
020,Lagos,0203502,"EYES ON THE FUTURE HIGH SCHOOL, OKO-OBA, AGEGE",20002,"WEMA BANK, ABULE EGBA","ABATTOIR, OKO-OBA",,,,,
020,Lagos,0203504,"SAM UNIQUE COLLEGE, IGBO-OLOMU, IKORODU",20025,"DIVISIONAL POLICE STATION, OWUTU AGRIC,",IKORODU,,,,,
020,Lagos,0203506,"MULTI-TREASURE COLLEGE, AJAH",20024,"FIRST BANK, AJAH",AJAH,,,,,
020,Lagos,0203516,"NIGERIAN TURKISH INTERNATIONAL COLLEGE, IKEJA",20012,"WEMA BANK, MARYLAND",MARYLAND,,,,,
020,Lagos,0203517,"BETHLEHEM GIRLS' COLLEGE, ABULE-ADO, LAGOS",20018,"NIGERIAN NAVY BARRACKS, NAVY TOWN, SATELLITE",SATELLITE,,,,,
020,Lagos,0203537,"SOLEIL HIGH SCHOOL, AGUDA, SURULERE",20001,"BODE THOMAS POLICE STATION, SURULERE",SURULERE,,,,,
020,Lagos,0203539,"FLORA HIGH SCHOOL, OGBA-AGUDA, LAGOS",20004,"WEMA BANK,OGBA",OGBA,,,,,
020,Lagos,0203540,"TRUSTY CHILD COLLEGE, IKOSI KETU, LAGOS",20007,"FIRST BANK PLC,KOSOFE",KOSOFE,,,,,
