state_code,state_name,sch_num,sch_name,cust_code,cust_name,cust_town,status,type,category,accd_year,lga
021,Niger,0215874,"MAHIJA COLLEGE, FADIKPE, MINNA",21023,"POLARIS BANK, MINNA",MINNA,,,,,
021,Niger,0215956,"MANA SCHOOLS, SAUKA KAHUTA, MINNA",21001,"NECO NIGER STATE OFFICE, MINNA A",MINNA,,,,,
021,Niger,0215958,"GIFTED ACADEMY INTERNATIONAL SCHOOL, TUDUN WADA, WUSHISHI",21010,"UNITY BANK, ZUNGERU",ZUNGERU,,,,,
021,Niger,0215959,"FIRST DIVINE VICTORY ACADEMY, BIDA",21004,"UNITY BANK PLC, BIDA",BIDA,,,,,
021,Niger,0215960,"STARLIGHT INERNATIONAL SCHOOL, MANDELA ROAD, SAUKA KAHUTA, MINNA",21001,"NECO NIGER STATE OFFICE, MINNA A",MINNA,,,,,
021,Niger,0215961,"KINGDOM GARRISON INTERNATIONAL COLLEGE, NYIKANGBE, MINNA",21002,POLICE STATION MORRIS FERTILIZER AREA,MINNA,,,,,
011,Enugu,0117274,"ANGLICAN GRAMMER SCHOOL, AWGU",11012,"SUB-TREASURY, AWGU",AWGU,,,,,
021,Niger,0215963,"HAZAKA INTERNATIONAL SCHOOL,  KONTAGORA",21008,"POLICE STATION, KONTAGORA",KONTAGORA,,,,,
021,Niger,0215964,"BERACAH ACADEMY, BOSSO ESTATE NEW EXTENSION, MINNA",21003,"POLICE STATION, BOSSO",BOSSO,,,,,
021,Niger,0215965,"POTTERS ACADEMY, BIDA",21004,"UNITY BANK PLC, BIDA",BIDA,,,,,
021,Niger,0215967,"JA ABUFIR INTERNATIONAL SCHOOL, SULEJA",21005,"UNITY BANK PLC, SULEJA",SULEJA,,,,,
021,Niger,0215968,"CPM INTERNATIONAL SCHOOL,  SULEJA",21006,"UNITY BANK, DAWAKI",DAWAKI,,,,,
021,Niger,0215969,"TOTALCARE INTERNATIONAL ACADEMY, KONTAGORA",21008,"POLICE STATION, KONTAGORA",KONTAGORA,,,,,
021,Niger,0216165,"SAAF INTERNATIONAL ACADEMY, SULEJA",21005,"UNITY BANK PLC, SULEJA",SULEJA,,,,,
021,Niger,0216166,"POOR HANDMAIDS OF JESUS CHRIST, TAFA",31003,"UNITY BANK, BWARI",BWARI,,,,,
021,Niger,0216167,"LATTER - RAIN HIGH SCHOOL, BIDA",21004,"UNITY BANK PLC, BIDA",BIDA,,,,,
021,Niger,0216169,"TROPHIES INTERNATIONAL SCHOOL, ANGUWAN KOMPANI, MINNA",21001,"NECO NIGER STATE OFFICE, MINNA A",MINNA,,,,,
021,Niger,0216318,"BAPTIST MODEL ACADEMY, UNGUWAN SARKI, ZUNGERU",21010,"UNITY BANK, ZUNGERU",ZUNGERU,,,,,
021,Niger,0216319,"NASFAT ACADEMY, NEW BUSSA",21009,"POLICE STATION, NEW - BUSSA",NEW - BUSSA,,,,,
021,Niger,0216321,"STELLA MARIS ENTREPRENEURSHIP ACADEMY, DUTSEN KURA, MINNA",21002,POLICE STATION MORRIS FERTILIZER AREA,MINNA,,,,,
021,Niger,0216464,"DABEN BRIGHTER ACADEMY, LAPAI",21019,"LEA, LAPAI",LAPAI,,,,,
021,Niger,0216465,"HOPE MODEL ACADEMY, WAWA",21009,"POLICE STATION, NEW - BUSSA",NEW - BUSSA,,,,,
021,Niger,0216466,"CHRIST APOSTOLIC CHURCH SECONDARY SCHOOL, NEW BUSSA",21009,"POLICE STATION, NEW - BUSSA",NEW - BUSSA,,,,,
021,Niger,0216467,"MABU ESSANTI INTERNATIONAL SCHOOL, MINNA",21002,POLICE STATION MORRIS FERTILIZER AREA,MINNA,,,,,
021,Niger,0216652,"APPLEHILLS ACADEMY, SULEJA",21006,"UNITY BANK, DAWAKI",DAWAKI,,,,,
011,Enugu,0117396,"THE SPIRIT OF DANIEL SECONDARY SCHOOL, ENUGU",11001,"P.P.S.M.B ZONAL OFFICE, ENUGU",ENUGU,,,,,
021,Niger,0216655,"COE MINNA MODEL SECONDARY SCHOOL, MINNA",21022,"POLICE STATION, CHANCHAGA",CHANCHAGA,,,,,
021,Niger,0216658,"DIVINE CHILD SCHOOL, KAFFIN KORO",21016,"POLICE STATION, KAFINKORO",KAFINKORO,,,,,
021,Niger,0216659,"DIVINE TWINKLE SECONDARY SCHOOL, MINNA",21003,"POLICE STATION, BOSSO",BOSSO,,,,,
021,Niger,0216848,DARUL ARQAM SCIENCE AND TECHNICAL COLLEGE BARKIN-SALE MINNA,21002,POLICE STATION MORRIS FERTILIZER AREA,MINNA,,,,,
021,Niger,0216849,TRAGECTORY EXCELLENT ACADEMY BIDA,21004,"UNITY BANK PLC, BIDA",BIDA,,,,,
021,Niger,0217906,"ADIEL INTERNATIONAL SCHOOL , MINNA",21022,"POLICE STATION, CHANCHAGA",CHANCHAGA,,,,,
021,Niger,0217907,ALMOND PEARL INTERNATIONAL SCHOOL LTD SULEJA,21006,"UNITY BANK, DAWAKI",DAWAKI,,,,,
021,Niger,0217908,"ANURI EDUCATIONAL SERVICES LIMITED, BIDA",21004,"UNITY BANK PLC, BIDA",BIDA,,,,,
021,Niger,0217909,"BEDROCK INTERNATIONAL SCHOOL, BIDA",21004,"UNITY BANK PLC, BIDA",BIDA,,,,,
021,Niger,0217910,"EL-HUDAAYAH INTERNATIONAL SCHOOL, MINNA",21001,"NECO NIGER STATE OFFICE, MINNA A",MINNA,,,,,
021,Niger,0217911,"HEROES INTERNATIONAL SCHOOL, MINNA",21001,"NECO NIGER STATE OFFICE, MINNA A",MINNA,,,,,
021,Niger,0217913,"MAW GLOBAL SCHOOLS, MINNA",21002,POLICE STATION MORRIS FERTILIZER AREA,MINNA,,,,,
021,Niger,0217915,"NEW DIVINE SUCCESS SCHOOL, GURARA, MINNA",21002,POLICE STATION MORRIS FERTILIZER AREA,MINNA,,,,,
021,Niger,0217917,"SGR CHILDREN ACADEMY, SULEJA",21005,"UNITY BANK PLC, SULEJA",SULEJA,,,,,
021,Niger,0218100,"ASSAFWA ACADEMY, MINNA",21003,"POLICE STATION, BOSSO",BOSSO,,,,,
021,Niger,0218101,"DAMA SCIENCE ACADEMY, BIDA",21004,"UNITY BANK PLC, BIDA",BIDA,,,,,
021,Niger,0218288,"TOP-CARE CLASSIC ACADEMY, TUNGA, MINNA",21001,"NECO NIGER STATE OFFICE, MINNA A",MINNA,,,,,
022,Ogun,0220028,"FEDERAL GOVERNMENT COLLEGE, ODOGBOLU",22004,NIGERIA POLICE STATION IPERU-REMO,IPERU-REMO,,,,,
022,Ogun,0220076,"NIGERIAN NAVY SECONDARY SCHOOL, ABEOKUTA",22001,"NECO OFFICE, ABEOKUTA",ABEOKUTA,,,,,
022,Ogun,0220088,THE BELLS COMPREHENSIVE SECONDARY SCHOOL,22002,"NIGERIAN POLICE STATION, IYANA-IYESI (MEGADEGS)",IYANA-IYESI,,,,,
012,Imo,0120177,"INTERNATIONAL SEC. SCHOOL, ORLU",12003,"ST. MARY'S PARISH, AMIFEKE ORLU",AMIFEKE ORLU,,,,,
022,Ogun,0220163,LORAL INTERNATIONAL SEC. SCHOOL,22019,"NIGERIA POLICE STATION, AGBARA",AGBARA,,,,,
022,Ogun,0220178,"CORONA SECONDARY SCHOOL, AGBARA",22019,"NIGERIA POLICE STATION, AGBARA",AGBARA,,,,,
022,Ogun,0220183,"THE INT'L SCHOOL, OLABISI ONABANJO UNIV.AGO-IWOYE",22020,"WEMA BANK, AGO - IWOYE",AGO - IWOYE,,,,,
022,Ogun,0220188,"CHRIST THE REDEEMER'S COLLEGE, SAGAMU",22003,"NIGERIA POLICE STATION, SAGAMU",SAGAMU,,,,,
022,Ogun,0220198,"REDEEMER'S HIGH SCHOOL, SAGAMU",22008,"GATEWAY MICROFINANCE BANK, MOWE",MOWE,,,,,
022,Ogun,0220200,"TRINITY INTERNATIONAL COLLEGE, OFADA",22016,"TRUST MICROFINANCE BANK, OWODE-EGBA",OWODE-EGBA,,,,,
022,Ogun,0220209,BABCOCK UNIVERSITY HIGH SCHOOL,22004,NIGERIA POLICE STATION IPERU-REMO,IPERU-REMO,,,,,
022,Ogun,0220222,"LOUISVILLE GIRLS HIGH SCHOOL, IJEBU - ITELE",22006,NIG. POSTAL AGENCY (NIPOST) IJEBU-MUSHIN,IJEBU-MUSHIN,,,,,
022,Ogun,0220246,"FAITH ACADEMY, OTA",22002,"NIGERIAN POLICE STATION, IYANA-IYESI (MEGADEGS)",IYANA-IYESI,,,,,
022,Ogun,0220400,"GRAIT INTERNATIONAL COLLEGE, OTA",22002,"NIGERIAN POLICE STATION, IYANA-IYESI (MEGADEGS)",IYANA-IYESI,,,,,
022,Ogun,0220402,"REGAL COLLEGE, SAGAMU",22003,"NIGERIA POLICE STATION, SAGAMU",SAGAMU,,,,,
022,Ogun,0220404,"O $ A ACADEMY, IKENNE - REMO",22004,NIGERIA POLICE STATION IPERU-REMO,IPERU-REMO,,,,,
022,Ogun,0220502,"SADIYYAH MODEL COLLEGE, ALAGBOLE, IFO",22007,"ADKOLM EMERALD MFB, AKUTE",AKUTE,,,,,
022,Ogun,0220608,"FEDERAL SCIENCE AND TECHNICAL COLLEGE, IJEBU - MUSHIN",22006,NIG. POSTAL AGENCY (NIPOST) IJEBU-MUSHIN,IJEBU-MUSHIN,,,,,
022,Ogun,0220655,"BADE UNIK SECONDARY SCHOOL, SAGAMU",22003,"NIGERIA POLICE STATION, SAGAMU",SAGAMU,,,,,
022,Ogun,0220658,"AMINAT INTERNATIONAL COLLEGE, OBANTOKO-ABEOKUTA",22014,"NIGERIA POLICE STATION, OBANTOKO",OBANTOKO,,,,,
021,Niger,0218291,JETS ACADEMY BIDA,21004,"UNITY BANK PLC, BIDA",BIDA,,,,,
021,Niger,0218290,"AMALE ROYALTY MODEL SCHOOL, MAITUMBI, MINNA",21001,"NECO NIGER STATE OFFICE, MINNA A",MINNA,,,,,
021,Niger,0218293,"FUTURE LEADERS INTERNATIONAL SCHOOLS, DAKWA",21007,POLICE STATION MADALLA,MADALLA,,,,,
021,Niger,0218292,"DESTINY KIDDIES INTERNATIONAL ACADEMY, DAKWA, SULEJA",21007,POLICE STATION MADALLA,MADALLA,,,,,
022,Ogun,0220753,"ACCESS INTERNATIONAL SCHOOLS, MAGBORO, OGUN",22011,"NIGERIA POLICE STATION, IBAFO",IBAFO,,,,,
022,Ogun,0220756,"VANGUARDS ACADEMY, ODOSENGOLU, IJEBU - ODE",22005,"NIGERIA POLICE STATION, IJEBU-ODE",IJEBU-ODE,,,,,
022,Ogun,0220758,"EARLY HEIGHTS COLLEGE, AKUTE",22007,"ADKOLM EMERALD MFB, AKUTE",AKUTE,,,,,
022,Ogun,0220759,WAMMY INTERNATIONAL SCHOOL,22007,"ADKOLM EMERALD MFB, AKUTE",AKUTE,,,,,
022,Ogun,0220787,"EPIC MODEL COLLEGE, IREWON IJEBU-ODE",22005,"NIGERIA POLICE STATION, IJEBU-ODE",IJEBU-ODE,,,,,
022,Ogun,0220828,"ISOLOG COLLEGE, ALAGBOLE, AKUTE",22007,"ADKOLM EMERALD MFB, AKUTE",AKUTE,,,,,
022,Ogun,0220891,"FUNAAB INT'L SCHOOL, ABEOKUTA",22014,"NIGERIA POLICE STATION, OBANTOKO",OBANTOKO,,,,,
022,Ogun,0220937,"ASSEMBLIES OF GOD HIGH SCHOOL, LOBURO MOWE",22023,"TRUST MFB, ASOLO",ASOLO,,,,,
022,Ogun,0220938,"THE AMBASSADORS COLLEGE, OTA",22002,"NIGERIAN POLICE STATION, IYANA-IYESI (MEGADEGS)",IYANA-IYESI,,,,,
022,Ogun,0220939,"CHRISTLEAD MODEL COLLEGE, OGIJO",22018,"NIG. POLICE STATION, OGIJO.",OGIJO.,,,,,
022,Ogun,0220949,"SACRED HEART CATHOLIC COLLEGE, ABEOKUTA",22001,"NECO OFFICE, ABEOKUTA",ABEOKUTA,,,,,
022,Ogun,0221047,"CHRIST THE KING CATHOLIC COLLEGE, IJEBU-ODE",22005,"NIGERIA POLICE STATION, IJEBU-ODE",IJEBU-ODE,,,,,
022,Ogun,0221048,COMMAND DAY SECONDARY SCHOOL IJEBU-ODE,22006,NIG. POSTAL AGENCY (NIPOST) IJEBU-MUSHIN,IJEBU-MUSHIN,,,,,
022,Ogun,0221053,"HEBRON COLLEGE, MOWE",22008,"GATEWAY MICROFINANCE BANK, MOWE",MOWE,,,,,
022,Ogun,0221132,"STRAITGATE COLLEGE, ISARA-REMO",22011,"NIGERIA POLICE STATION, IBAFO",IBAFO,,,,,
022,Ogun,0221133,"DALOS COLLEGE, OTA",22002,"NIGERIAN POLICE STATION, IYANA-IYESI (MEGADEGS)",IYANA-IYESI,,,,,
022,Ogun,0221170,"ELYON  COLLEGE AND LEADERSHIP  ACADEMY, KEMTA",22001,"NECO OFFICE, ABEOKUTA",ABEOKUTA,,,,,
022,Ogun,0221171,"EMERALD SCHOOLS, OGUNRUNORI, MOWE",22008,"GATEWAY MICROFINANCE BANK, MOWE",MOWE,,,,,
022,Ogun,0221172,"KAWEFUNMI SECONDARY  SCHOOL, SAGAMU",22003,"NIGERIA POLICE STATION, SAGAMU",SAGAMU,,,,,
022,Ogun,0221174,"SEOLAND INTERNATIONAL SCHOOL, MOWE",22008,"GATEWAY MICROFINANCE BANK, MOWE",MOWE,,,,,
022,Ogun,0221175,"JACOBS  HIGH SCHOO, SANGO-OTA",22002,"NIGERIAN POLICE STATION, IYANA-IYESI (MEGADEGS)",IYANA-IYESI,,,,,
022,Ogun,0221176,VINEYARD COLLEGE,22005,"NIGERIA POLICE STATION, IJEBU-ODE",IJEBU-ODE,,,,,
022,Ogun,0221525,RAINBOW COLLEGE ASESE MOBA,22011,"NIGERIA POLICE STATION, IBAFO",IBAFO,,,,,
022,Ogun,0221527,OMOTAYO COLLEGE OGIJIO,22018,"NIG. POLICE STATION, OGIJO.",OGIJO.,,,,,
022,Ogun,0221599,"OMOLAJA SODIPO MEMORIAL ANGLICAN SCHOOL, ABEOKUTA",22001,"NECO OFFICE, ABEOKUTA",ABEOKUTA,,,,,
022,Ogun,0221600,"COMPREHENSIVE ACADEMY, LAFENWA ABEOKUTA",22021,"LAVENDER MICRO FINANCE BANK, LAFENWA",ABEOKUTA,,,,,
022,Ogun,0221642,"CHRISTOWER INTERNATIONAL SCHOOL, IBAFO",22011,"NIGERIA POLICE STATION, IBAFO",IBAFO,,,,,
022,Ogun,0221814,HEBRON DAY SRING HIGH SCH IBAFO,22011,"NIGERIA POLICE STATION, IBAFO",IBAFO,,,,,
022,Ogun,0222385,"ADVANCED BREED COMPREHENSIVE COLLEGE, GRA, SHAGAMU",22003,"NIGERIA POLICE STATION, SAGAMU",SAGAMU,,,,,
022,Ogun,0222597,"APOSTOLIC FAITH SECONDARY SCHOOL, ADATAN, ABEOKUTA",22001,"NECO OFFICE, ABEOKUTA",ABEOKUTA,,,,,
022,Ogun,0222865,"DEEPER LIFE HIGH SCHOOL, MOWE",22008,"GATEWAY MICROFINANCE BANK, MOWE",MOWE,,,,,
022,Ogun,0223062,"THE BRIDGE COLLEGE, ABEOKUTA",22001,"NECO OFFICE, ABEOKUTA",ABEOKUTA,,,,,
022,Ogun,0223063,"COVENANT UNIVERSITY SECONDARY SCHOOL, OTA",22002,"NIGERIAN POLICE STATION, IYANA-IYESI (MEGADEGS)",IYANA-IYESI,,,,,
022,Ogun,0223064,"FAITH HERITAGE COLLEGE, OBANTOKO, ABEOKUTA",22014,"NIGERIA POLICE STATION, OBANTOKO",OBANTOKO,,,,,
022,Ogun,0223066,"D-IVY COLLEGE, OTA",22002,"NIGERIAN POLICE STATION, IYANA-IYESI (MEGADEGS)",IYANA-IYESI,,,,,
022,Ogun,0223067,"LOGIC HIGH SCHOOL, DALEMO, AGBADO",22012,"NIGERIA POLICE STATION, AGBADO",AGBADO,,,,,
022,Ogun,0223223,"CAROS STANDARD HIGH SCHOOL, PAPA IBAFO",22011,"NIGERIA POLICE STATION, IBAFO",IBAFO,,,,,
022,Ogun,0223224,"ULTRA INTERNATIONAL COLLEGE, AKUTE",22007,"ADKOLM EMERALD MFB, AKUTE",AKUTE,,,,,
022,Ogun,0223225,"DEEPER LIFE HIGH SCHOOL,  ABEOKUTA",22014,"NIGERIA POLICE STATION, OBANTOKO",OBANTOKO,,,,,
022,Ogun,0223316,"EASYWAY INTERNATIONAL MODEL COLLEGE, ARO",22021,"LAVENDER MICRO FINANCE BANK, LAFENWA",ABEOKUTA,,,,,
022,Ogun,0223317,"MARIE BALAVENNE'S CATHOLIC COLLEGE, ILOGBO-ASHOWO",22002,"NIGERIAN POLICE STATION, IYANA-IYESI (MEGADEGS)",IYANA-IYESI,,,,,
022,Ogun,0223374,"CITY OF KNOWLEDGE ACADEMY, IJEBU-ODE",22005,"NIGERIA POLICE STATION, IJEBU-ODE",IJEBU-ODE,,,,,
022,Ogun,0223376,"COMMAND DAY SECONDARY SCHOOL, LAFENWA",22021,"LAVENDER MICRO FINANCE BANK, LAFENWA",ABEOKUTA,,,,,
022,Ogun,0223509,"WALES INTERNATIONAL SCHOOLS, ASEESE",22008,"GATEWAY MICROFINANCE BANK, MOWE",MOWE,,,,,
022,Ogun,0223510,"GOLDEN GRACE INTERNATIONAL SCHOOLS, OLUWO, ABEOKUTA",22001,"NECO OFFICE, ABEOKUTA",ABEOKUTA,,,,,
022,Ogun,0223512,"PEACE FOUNDATION INTERNATIONAL COLLEGE, AGBELOBA, ABEOKUTA",22021,"LAVENDER MICRO FINANCE BANK, LAFENWA",ABEOKUTA,,,,,
022,Ogun,0223513,"AFRICAN CHURCH GRAMMAR SCHOOL (MISSION), ITA-IYALODE, ABEOKUTA",22001,"NECO OFFICE, ABEOKUTA",ABEOKUTA,,,,,
022,Ogun,0223514,"OAKFIELD SECONDARY SCHOOL, PAPA OLORUNDA, IBAFO",22011,"NIGERIA POLICE STATION, IBAFO",IBAFO,,,,,
022,Ogun,0223544,"BABCOCK ACADEMY, ABEOKUTA",22001,"NECO OFFICE, ABEOKUTA",ABEOKUTA,,,,,
022,Ogun,0223545,"ANTHONY WHITE BRIDGE SECONDARY SCHOOL, LOBURO-MOWE",22023,"TRUST MFB, ASOLO",ASOLO,,,,,
022,Ogun,0223546,"ANU-OLU INTERNATIONAL COLLEGE, ABEOKUTA",22001,"NECO OFFICE, ABEOKUTA",ABEOKUTA,,,,,
022,Ogun,0223548,"INTERNATIONAL COLLEGE, IBEFUN",22005,"NIGERIA POLICE STATION, IJEBU-ODE",IJEBU-ODE,,,,,
022,Ogun,0223549,"MAYFLOWER PRIVATE SCHOOL, IKENNE",22004,NIGERIA POLICE STATION IPERU-REMO,IPERU-REMO,,,,,
022,Ogun,0223550,"OUR GOD REIGNS CRYSTAL SCHOOL, OTA",22002,"NIGERIAN POLICE STATION, IYANA-IYESI (MEGADEGS)",IYANA-IYESI,,,,,
022,Ogun,0223663,"JEXTOBAN SECONDARY SCHOOL, IBAFO",22011,"NIGERIA POLICE STATION, IBAFO",IBAFO,,,,,
022,Ogun,0223664,"GOOD SHEPHERD COMPREHENSIVE HIGH SCHOOL, ALAKUKO",22012,"NIGERIA POLICE STATION, AGBADO",AGBADO,,,,,
022,Ogun,0223666,"BAPTIST GIRLS' COLLEGE (MISSION), IDI-ABA, ABEOKUTA",22001,"NECO OFFICE, ABEOKUTA",ABEOKUTA,,,,,
022,Ogun,0223669,"GOOD SHEPHERD COMPREHENSIVE HIGH SCHOOL, ATAN",22002,"NIGERIAN POLICE STATION, IYANA-IYESI (MEGADEGS)",IYANA-IYESI,,,,,
022,Ogun,0223671,"BAPTIST BOYS' HIGH SCHOOL (MISSION), ABEOKUTA",22021,"LAVENDER MICRO FINANCE BANK, LAFENWA",ABEOKUTA,,,,,
022,Ogun,0223829,"LIVING LEGACY SECONDARY SCHOOL, ITA OLOWO OGIJO",22018,"NIG. POLICE STATION, OGIJO.",OGIJO.,,,,,
022,Ogun,0223830,"HIGHERLAND SECONDARY SCHOOL, MOWE",22023,"TRUST MFB, ASOLO",ASOLO,,,,,
022,Ogun,0223831,"CECIL COLLEGE, MATOGUN OKE ARO",22012,"NIGERIA POLICE STATION, AGBADO",AGBADO,,,,,
022,Ogun,0223833,"VICTORROTI PRIVATE SECONDARY SCHOOL, IDI-ABA, ABEOKUTA",22001,"NECO OFFICE, ABEOKUTA",ABEOKUTA,,,,,
022,Ogun,0223834,"DIVINE WILL SECONDARY SCHOOL, LOBURO MOWE",22023,"TRUST MFB, ASOLO",ASOLO,,,,,
022,Ogun,0223836,"FEDERAL COLLEGE OF EDUCATION MODEL SECONDARY SCHOOL, OSIELE, ABEOKUTA",22014,"NIGERIA POLICE STATION, OBANTOKO",OBANTOKO,,,,,
022,Ogun,0223837,"HERITREATS PRIVATE SECONDARY SCHOOL, IBAFO",22011,"NIGERIA POLICE STATION, IBAFO",IBAFO,,,,,
022,Ogun,0223838,"DOMINION COLLEGE INTERNATIONAL, MOWE",22008,"GATEWAY MICROFINANCE BANK, MOWE",MOWE,,,,,
022,Ogun,0223840,"THAMES VALLEY COLLEGE, SAGUMU",22018,"NIG. POLICE STATION, OGIJO.",OGIJO.,,,,,
022,Ogun,0223846,"BRIGHTWAY COLLEGE, LAFENWA ABEOKUTA",22021,"LAVENDER MICRO FINANCE BANK, LAFENWA",ABEOKUTA,,,,,
022,Ogun,0223848,"AL-HIJRAH COLLEGE, ALAPAKO ONI, OGUNMAKIN",22017,"ASTRA POLARIS BANK, OGUNMAKIN",OGUNMAKIN,,,,,
022,Ogun,0223849,"TRANSFORMATION INTERNATIONAL SCHOOLS, MOWE",22023,"TRUST MFB, ASOLO",ASOLO,,,,,
022,Ogun,0223850,"GRACE COLLEGE, IPERU-REMO",22004,NIGERIA POLICE STATION IPERU-REMO,IPERU-REMO,,,,,
022,Ogun,0224049,"FUNBIS HIGH SCHOOL, ORIMERUNMU, MOWE",22023,"TRUST MFB, ASOLO",ASOLO,,,,,
022,Ogun,0224050,"EAGERMINDS COLLEGE, ROBINYAN ABULE-IJOKO",22002,"NIGERIAN POLICE STATION, IYANA-IYESI (MEGADEGS)",IYANA-IYESI,,,,,
012,Imo,0126265,"GOOD MORNING INTERNATIONAL SECONDARY SCHOOL, AKWAKUMA OWERRI",12001,"NECO OFFICE, OWERRI",OWERRI,,,,,
022,Ogun,0224051,"PATTERSON MEMORIAL BAPTIST GRAMMAR SCHOOL, ABEOKUTA",22001,"NECO OFFICE, ABEOKUTA",ABEOKUTA,,,,,
022,Ogun,0224182,"DEO-LES PATH - FINDERS COLLEGE, MOWE",22023,"TRUST MFB, ASOLO",ASOLO,,,,,
022,Ogun,0224184,"BOSDEM COLLEGE, ABEOKUTA",22001,"NECO OFFICE, ABEOKUTA",ABEOKUTA,,,,,
022,Ogun,0224185,"PEARTREE INTERNATIONAL COLLEGE, OLOMORE",22021,"LAVENDER MICRO FINANCE BANK, LAFENWA",ABEOKUTA,,,,,
022,Ogun,0224259,"IMPACT HOUSE COLLEGE, MOWE",22023,"TRUST MFB, ASOLO",ASOLO,,,,,
022,Ogun,0224264,"HOLY SAVIOUR COLLEGE, LAFENWA",22002,"NIGERIAN POLICE STATION, IYANA-IYESI (MEGADEGS)",IYANA-IYESI,,,,,
022,Ogun,0224265,"MUEENAT INTERNATIONAL ACADEMY, ABEOKUTA",22001,"NECO OFFICE, ABEOKUTA",ABEOKUTA,,,,,
022,Ogun,0224325,"QUANTUM COLLEGE, OFADA",22016,"TRUST MICROFINANCE BANK, OWODE-EGBA",OWODE-EGBA,,,,,
022,Ogun,0224398,"YESHUA  HIGH SCHOOL, OJODU-BERGER",22007,"ADKOLM EMERALD MFB, AKUTE",AKUTE,,,,,
012,Imo,0126437,"JESUS CHILDREN SECONDARY SCHOOL, IHIAGWA, OWERRI",12008,"ST. PATRICK'S PARISH, NEKEDE",NEKEDE,,,,,
022,Ogun,0224399,"PEARLSTONE COLLEGE, MAGBORO",22011,"NIGERIA POLICE STATION, IBAFO",IBAFO,,,,,
022,Ogun,0224400,"YEMI OGUNBIYI ANGLICAN COLLEGE, SAGAMU",22003,"NIGERIA POLICE STATION, SAGAMU",SAGAMU,,,,,
022,Ogun,0224519,"FRANKLIN COMPREHENSIVE SCHOOL, MAGBORO",22011,"NIGERIA POLICE STATION, IBAFO",IBAFO,,,,,
022,Ogun,0224522,"GOD'S TIME COLLEGE, MOWE",22023,"TRUST MFB, ASOLO",ASOLO,,,,,
022,Ogun,0224524,"ANSAR-UD-DEEN INTERNATIONAL COLLEGE, ITA-OSHIN, ABEOKUTA",22021,"LAVENDER MICRO FINANCE BANK, LAFENWA",ABEOKUTA,,,,,
022,Ogun,0224528,"MIGHTY SCHOOL FOR VALOUR, OSUKE-OTA",22002,"NIGERIAN POLICE STATION, IYANA-IYESI (MEGADEGS)",IYANA-IYESI,,,,,
022,Ogun,0224529,"ST. JOHN'S ACADEMY, IDIROKO",22022,"WEMA BANK, IDIROKO",IDIROKO,,,,,
022,Ogun,0224530,"AL-MINHAAJ MODEL COLLEGE, OWODE YEWA",22013,WEMA BANK PLC OWODE-YEWA,OWODE-YEWA,,,,,
022,Ogun,0224587,"HIGHER STILL ACADEMY, ORIMERUNMO",22008,"GATEWAY MICROFINANCE BANK, MOWE",MOWE,,,,,
022,Ogun,0224592,"MARAVILLA COLLEGE, OLOTUN",22008,"GATEWAY MICROFINANCE BANK, MOWE",MOWE,,,,,
022,Ogun,0224657,"OLIVE HOUSE ACADEMY COLLEGE, MOWE",22008,"GATEWAY MICROFINANCE BANK, MOWE",MOWE,,,,,
022,Ogun,0224658,"HILLTOP EXCELLENCE COLLEGE, AKUTE",22007,"ADKOLM EMERALD MFB, AKUTE",AKUTE,,,,,
022,Ogun,0224660,"HAVARD HIGH SCHOOL, AREPO",22011,"NIGERIA POLICE STATION, IBAFO",IBAFO,,,,,
022,Ogun,0224662,"UPPER ROOM ACADEMY (SECONDARY), IJERE",22008,"GATEWAY MICROFINANCE BANK, MOWE",MOWE,,,,,
022,Ogun,0224664,"VINE CREST COLLEGE, IPERU-REMO",22004,NIGERIA POLICE STATION IPERU-REMO,IPERU-REMO,,,,,
022,Ogun,0224666,"L.H.S. COLLEGE, OTA",22002,"NIGERIAN POLICE STATION, IYANA-IYESI (MEGADEGS)",IYANA-IYESI,,,,,
022,Ogun,0224793,"ACE CLASS COLLEGE, LOBURO, MOWE",22008,"GATEWAY MICROFINANCE BANK, MOWE",MOWE,,,,,
022,Ogun,0224794,"WELKIN INTERNATIONAL SCHOOL,  AJIBAWO, ATAN OTA",22002,"NIGERIAN POLICE STATION, IYANA-IYESI (MEGADEGS)",IYANA-IYESI,,,,,
022,Ogun,0224796,"PRIDE OF FAITH ACADEMY, SAGAMU",22003,"NIGERIA POLICE STATION, SAGAMU",SAGAMU,,,,,
022,Ogun,0224797,"ERUDITE CREST COLLEGE, OPIC ISHERI",22011,"NIGERIA POLICE STATION, IBAFO",IBAFO,,,,,
022,Ogun,0224798,"LUMEN CHRISTI COLLEGE, EWU OLOYE MAYA, OGIJO",22018,"NIG. POLICE STATION, OGIJO.",OGIJO.,,,,,
022,Ogun,0224799,"ALPHA CHOICE INNOVATIVES ACADEMY, AREPO OBAFEMI OWODE",22011,"NIGERIA POLICE STATION, IBAFO",IBAFO,,,,,
022,Ogun,0225261,HIS LORDSHIP PRIVATE SECONDARY SCHOOLSAGAMU GRA EXTENSION,22003,"NIGERIA POLICE STATION, SAGAMU",SAGAMU,,,,,
022,Ogun,0225262,"ARCHBISHOP DADA AKINDE ANGLICAN COMPREHENSIVE ACADEMY, IKIJA, IBEREKODO, ABEOKUTA",22021,"LAVENDER MICRO FINANCE BANK, LAFENWA",ABEOKUTA,,,,,
022,Ogun,0225263,"JUBILEE INTERNATIONAL COLLEGE, ISALE-ABETU, ISALE-AKE, ABEOKUTA",22014,"NIGERIA POLICE STATION, OBANTOKO",OBANTOKO,,,,,
022,Ogun,0225344,"LYCEUM COLLEGE, HARMONY ESTATE IKEREKU LADERIN, ABEOKUTA",22001,"NECO OFFICE, ABEOKUTA",ABEOKUTA,,,,,
022,Ogun,0225428,"ORION ACADEMY, SAGAMU",22003,"NIGERIA POLICE STATION, SAGAMU",SAGAMU,,,,,
022,Ogun,0225429,"TAOHEED MEMORIAL COLLEGE, MOWE",22023,"TRUST MFB, ASOLO",ASOLO,,,,,
022,Ogun,0225430,"COUNTY CREST COLLEGE, IMEDUN NLA, MOWE",22008,"GATEWAY MICROFINANCE BANK, MOWE",MOWE,,,,,
022,Ogun,0225431,"CHORAS MODEL COLLEGE, ARIWO, OWODE EGBA",22016,"TRUST MICROFINANCE BANK, OWODE-EGBA",OWODE-EGBA,,,,,
022,Ogun,0225432,"FAITH HERITAGE GOLD COLLEGE, ELEGA, ABEOKUTA",22021,"LAVENDER MICRO FINANCE BANK, LAFENWA",ABEOKUTA,,,,,
022,Ogun,0225453,"AYODELE COLLEGE OF EXCELLENCE, ODE-LEMO ROAD, SAGAMU",22003,"NIGERIA POLICE STATION, SAGAMU",SAGAMU,,,,,
022,Ogun,0225508,"GREAT  A  GENESIS ACADEMY,  AKUTE",22007,"ADKOLM EMERALD MFB, AKUTE",AKUTE,,,,,
022,Ogun,0225509,BIL QALAM MODEL SCHOOL AGO-IWOYE,22020,"WEMA BANK, AGO - IWOYE",AGO - IWOYE,,,,,
022,Ogun,0225510,"THE NEW COVENANT BAPTIST ACADEMY, AKUTE",22007,"ADKOLM EMERALD MFB, AKUTE",AKUTE,,,,,
022,Ogun,0225970,"SPRINGWORTH SECONDARY SCHOOL, AREPO",22011,"NIGERIA POLICE STATION, IBAFO",IBAFO,,,,,
022,Ogun,0225972,"REDEEMER'S ACADEMY, LOBURO, MOWE",22023,"TRUST MFB, ASOLO",ASOLO,,,,,
022,Ogun,0225973,"THE CANDID ACADEMY, MAGBORO",22011,"NIGERIA POLICE STATION, IBAFO",IBAFO,,,,,
022,Ogun,0225974,"BABCOCK UNIVERSITY HIGH SCHOOL, OJODU BERGER",22011,"NIGERIA POLICE STATION, IBAFO",IBAFO,,,,,
022,Ogun,0225975,"SIMCITY COLLEGE, OFADA",22008,"GATEWAY MICROFINANCE BANK, MOWE",MOWE,,,,,
022,Ogun,0225976,"ESTBANK ACADEMY, OFADA",22008,"GATEWAY MICROFINANCE BANK, MOWE",MOWE,,,,,
022,Ogun,0225977,"TRANSATLANTIC COLLEGE, SAGAMU",22003,"NIGERIA POLICE STATION, SAGAMU",SAGAMU,,,,,
022,Ogun,0225978,"ABEOKUTA GIRLS GRAMMAR SCHOOL (PRIVATE), ONIKOLOBO, ABEOKUTA",22001,"NECO OFFICE, ABEOKUTA",ABEOKUTA,,,,,
022,Ogun,0225979,"DAYSPRING MODEL COLLEGE, ILUPEJU, CAMP, ABEOKUTA",22001,"NECO OFFICE, ABEOKUTA",ABEOKUTA,,,,,
022,Ogun,0225980,"ROCKCREST COLLEGE, IBARA, ABEOKUTA",22001,"NECO OFFICE, ABEOKUTA",ABEOKUTA,,,,,
022,Ogun,0226170,"FIRDAUS-GATE MODEL COLLEGE, OMO OLODE, MAGBORO",22011,"NIGERIA POLICE STATION, IBAFO",IBAFO,,,,,
022,Ogun,0226223,"READ AND LEAD INTERNATIONAL SCHOOL, MOWE",22008,"GATEWAY MICROFINANCE BANK, MOWE",MOWE,,,,,
012,Imo,0126795,"ANNUNCIATION CONVENT, UMUEZE 1",12016,"ST. MICHEAL'S PARISH, UMUEZE 1",UMUEZE 1,,,,,
022,Ogun,0226224,"RIVERSIDE COLLEGE, ISHERI OLOFIN, IFO",22011,"NIGERIA POLICE STATION, IBAFO",IBAFO,,,,,
022,Ogun,0226323,"MAVICS COLLEGE, OBAFEMI OWODE",22008,"GATEWAY MICROFINANCE BANK, MOWE",MOWE,,,,,
022,Ogun,0226324,"THE SCIENCE MODEL COLLEGE, LAFENWA ABEOKUTA",22021,"LAVENDER MICRO FINANCE BANK, LAFENWA",ABEOKUTA,,,,,
022,Ogun,0226325,"TOP TEES COLLEGE, OPAKO ADIGBE, ABEOKUTA",22001,"NECO OFFICE, ABEOKUTA",ABEOKUTA,,,,,
022,Ogun,0226661,"CALVARY ARROWS COLLEGE, OBA, ABEOKUTA",22001,"NECO OFFICE, ABEOKUTA",ABEOKUTA,,,,,
022,Ogun,0226662,"DE-ROYAL APPLE COLLEGE, AKUTE",22007,"ADKOLM EMERALD MFB, AKUTE",AKUTE,,,,,
022,Ogun,0226663,"GOFAMINT HERITAGE INTERNATIONAL HIGH SCHOOL, ASEESE",22008,"GATEWAY MICROFINANCE BANK, MOWE",MOWE,,,,,
022,Ogun,0226664,"THE PILLARS COLLEGE, ORIMERUNMU, MOWE",22008,"GATEWAY MICROFINANCE BANK, MOWE",MOWE,,,,,
022,Ogun,0226665,"WHITEWOOD ACADEMY, MOWE",22008,"GATEWAY MICROFINANCE BANK, MOWE",MOWE,,,,,
022,Ogun,0227919,"DEFENDERS' MODEL COLLEGE, OKE-IMOSAN, ABEOKUTA",22001,"NECO OFFICE, ABEOKUTA",ABEOKUTA,,,,,
022,Ogun,0227920,"EMAAYO MODEL COLLEGE, OWODE YEWA",22013,WEMA BANK PLC OWODE-YEWA,OWODE-YEWA,,,,,
022,Ogun,0227921,"GLORIOUS KING COLLEGE, OKE IMOSAN, ABEOKUTA",22001,"NECO OFFICE, ABEOKUTA",ABEOKUTA,,,,,
022,Ogun,0227922,"LEADING PARAGON HIGH SCHOOL, LOBURO, MOWE",22023,"TRUST MFB, ASOLO",ASOLO,,,,,
022,Ogun,0227923,"O & A CLASSIC COLLEGE, SAGAMU",22003,"NIGERIA POLICE STATION, SAGAMU",SAGAMU,,,,,
022,Ogun,0228104,"JORAI COLLEGE, KEMTA-IDI ABA, ABEOKUTA",22001,"NECO OFFICE, ABEOKUTA",ABEOKUTA,,,,,
022,Ogun,0228105,"KING DAVID SCHOOL, MAMAGOLD ADESAN, MOWE",22023,"TRUST MFB, ASOLO",ASOLO,,,,,
022,Ogun,0227924,"TREASURE OF FAITH COLLEGE, ABEOKUTA",22001,"NECO OFFICE, ABEOKUTA",ABEOKUTA,,,,,
022,Ogun,0228106,"REMINISCE HIGH SCHOOL, LOTTO/BSTOP,PAKURO,MOWE",22023,"TRUST MFB, ASOLO",ASOLO,,,,,
023,Ondo,0230030,"FEDERAL GOVERNMENT COLLEGE, IDOANI",23006,"POLICE STATION, IDO-ANI",IDO-ANI,,,,,
012,Imo,0126821,"SIV-GOLD MODEL SECONDARY SCHOOL, NNERIM NDUGBA",12014,"ST. MARY'S PARISH, UMUNDUGBA",UMUNDUGBA,,,,,
023,Ondo,0230031,"FEDERAL GOVERNMENT GIRLS' COLLEGE, AKURE",23001,"BANK OF AGRICULTURE, AKURE",AKURE,,,,,
023,Ondo,0230086,"F.U.T STAFF SECONDARY SCHOOL, AKURE",23002,"NECO OFFICE, AKURE",AKURE,,,,,
023,Ondo,0230132,"GLORYFIELD INTERNATIONAL COLLEGE, ILE-OLUJI",23004,"NIGERIAN SECURITY & CIVIL DEFENCE CORPS, ONDO",ONDO,,,,,
023,Ondo,0230135,"OLA-OLUWA COLLEGE, IJU",23003,"POLICE STATION, IJU",IJU,,,,,
023,Ondo,0230261,"CHRIST THE REDEEMER'S INTERNATIONAL SECONDARY SCHOOL, AKURE",23002,"NECO OFFICE, AKURE",AKURE,,,,,
023,Ondo,0230338,"BECKY PARKER COLLEGE, AKURE",23001,"BANK OF AGRICULTURE, AKURE",AKURE,,,,,
023,Ondo,0230609,"FEDERAL SCIENCE AND TECHNICAL COLLEGE, IKARE AKOKO",23007,"LEGION OFFICE, IKARE",IKARE,,,,,
023,Ondo,0230623,"GREATER TOMORROW INTERNATIONAL COLLEGE, ARIGIDI AKOKO",23007,"LEGION OFFICE, IKARE",IKARE,,,,,
023,Ondo,0230773,"ST. MATTHIAS ANGLICAN HIGH SCHOOL, AKURE",23001,"BANK OF AGRICULTURE, AKURE",AKURE,,,,,
023,Ondo,0230886,"POLICE SECONDARY SCHOOL, AKURE",23003,"POLICE STATION, IJU",IJU,,,,,
023,Ondo,0231177,"PRESTON INTERNATIONAL SCHOOL  , AKURE",23001,"BANK OF AGRICULTURE, AKURE",AKURE,,,,,
023,Ondo,0231679,"ST. WILLIAMS CATHOLIC COLLEGE, OKITIPUPA",23005,"AREA EDUCATION OFFICE, OKITIPUPA",OKITIPUPA,,,,,
022,Ogun,0228295,POLICE SECONDARY SCHOOL SAGAMU,22003,"NIGERIA POLICE STATION, SAGAMU",SAGAMU,,,,,
022,Ogun,0228296,"EXCELLENT HIGH SCHOOL, SABO SAGAMU",22003,"NIGERIA POLICE STATION, SAGAMU",SAGAMU,,,,,
022,Ogun,0228298,"TOPCLASS COMPREHENSIVE COLLEGE, ASEESE IBAFO",22011,"NIGERIA POLICE STATION, IBAFO",IBAFO,,,,,
023,Ondo,0231735,"CALVARY INTERNATIONAL COLLEGE, ODA-AKURE",23002,"NECO OFFICE, AKURE",AKURE,,,,,
023,Ondo,0233228,"EMPLACE COLLEGE, AKURE",23001,"BANK OF AGRICULTURE, AKURE",AKURE,,,,,
012,Imo,0127796,"FOUNDATION OF WISDOM COLLEGE, NEMPI",12006,"ST. STEPHEN'S ANGLICAN CHURCH, OTULU",OTULU,,,,,
023,Ondo,0233229,"IMPACT HIGH SCHOOL, AKURE",23001,"BANK OF AGRICULTURE, AKURE",AKURE,,,,,
023,Ondo,0233377,"DEEPER LIFE HIGH SCHOOL, IWOYE, AKURE",23002,"NECO OFFICE, AKURE",AKURE,,,,,
023,Ondo,0233378,"NIGERIAN NAVY SECONDARY SCHOOL, IMERI",23006,"POLICE STATION, IDO-ANI",IDO-ANI,,,,,
023,Ondo,0233552,"MABEST ACADEMY, OKE-IJEBU AKURE",23001,"BANK OF AGRICULTURE, AKURE",AKURE,,,,,
